1411,Prince Aly Khan Hospital Blood Bank,Maharashtra,MUMBAI,Mumbai,"Aga Hall, Nesbit Road, Mazgaon, Mumbai ",400010,"022 23777934, 022 23777936, 022 23777800, 022 23777907, 022 23777908",9821035341,,022 23743820,,http://info@pakh.net,Dr. Vijay Laxmi Ray   ,022 23777934,9821035341,"pakhbb@gmail.com, dr.ray@pakh.net",MD (Pathology),Charity,YES,YES,24x7,28-C:9 ,3/3/2010,3/2/2015,18.97084,72.836617
1412,Dr. R. N. Cooper General Hospital Blood Bank,Maharashtra,MUMBAI,Mumbai,"North south Road No-1, Juhu, Vile-Parle (W) Mumbai",400056,"022 26242609, 022 26247254, 022 26247255, 022 26247256 (Extn. 201, 203)",9987063770,,022 26205897 ,,,"Dr. Yaseen Khatib, Dr Richa Patel , Dr Parag    ","022 26207256, 022 26207254 (Extn. 263)","09987063770, 09890833141","sahirkhatib@yahoo.com, dr.richa.13@gmail.com, cooperbloodbank@yahoo.in  ",MD (Pathology),Government,NO,NO,24x7,1055,1/3/1991,Applied for renewal,19.107714,72.835618
1413,Rajawadi Blood Bank - Seth V. C. Gandhi & M. A. Vora Municipal General Hospital,Maharashtra,MUMBAI,Mumbai,"Seth V. C. Gandhi and M. A. Vora M, Rajawadi, Ghatkopar-(E), Mumbai",400077,"022 21025611 (Extn. 141, 122)",9892784878,,022 21027372 ,,,Dr. Sharad Arulekar ,022 21025149  ,9892784878,"rajawadi.rbb04@gmail.com,  rajawadihospital@gmail.com",MBBS,Government,NO,NO,24x7,MH004617       ,28-05-2008 ,28-05-2013,19.079304,72.901693
1414,S. L. Raheja Hospital Blood Bank,Maharashtra,MUMBAI,Mumbai,"Mahim, Raheja Rugnalaya Marg, Mumbai",400016,"022 24445528, 022 66529682, 022 24449418",9821241031,,,,,Dr. Neelam Nijhara  ,"022 24445528, 022 66529682, 022 66529683 ",9821241031,"nnijhara@yahoo.com, bloodbank@rahejahospital.com","MBBS, DPH",Charity,YES,YES,24x7,28-C/43                          ,14-07-2009,Applied for renewal,19.046572,72.842207
1415,S. R. Mehta and Sir. K.P. Cardiac Institute Blood Bank,Maharashtra,MUMBAI,Mumbai,"Plot No. 96, Road No.31, King Circle Sion, (E) Mumbai  ",400022,"022 24035454, 022 2409 4732",9987020981,,022 24094732,,,Dr. Suresh Kothari  ,022 24035454 to 022 24035459 ,9987020981,"drsureshkothari@gmail.com, srmkp@vsnl.net",MD,Charity,YES,YES,24x7,35/28-c  ,25-06-2001,31-12-2017,19.032412,72.85958
1416,Saifee Hospital Trust Blood Bank,Maharashtra,MUMBAI,Mumbai,"15/17, Maharishi Karve Marg, Opposite to Charni Road Station Mumbai",400004,022 67571140,9869784307,,022 67570777,,http://www.write@saifee.com,Dr. Mrs.Ainy A. Choonia   ,"022 67570111, 022 67571140, 022 67571144, 022 67571145",9869784307,"saifeebloodbank@yahoo.co.in, write@saifeehospital.com","MBBS, DPB",Charity,YES,YES,24x7,28C/47 ,16-08-2005,Applied for renewal,18.952471,72.818058
1417,Sarvodaya Hospital Samarpan Blood Bank,Maharashtra,MUMBAI,Mumbai,"Office Building, 2nd Floor, Sarvodaya Hospital, LBS  Marg, Ghatkopar (W), Mumbai",400086,"022 25102511, 022 25100100",9594032520,,022 25111313,,,M. S. Poonam Yadav,9594032520,9820973780,"samarpanbb@gmail.com, yadav.punam@gmail.com",B.Sc. (Micro) & PGDMLT,Charity,YES,YES,24x7,28C/48,16-06-2007,15-06-2017,19.089801,72.907187
1418,Seven Hills Health Care Private Limited Hospital Blood Bank,Maharashtra,MUMBAI,Mumbai,"Blood Bank, 2nd Floor, Block-16, Seven Hills Hospital,  Survey No.155, 156, 162 - 168 Part, Marol - Maroshi Road,  
Andheri (E), Mumbai ",400059,022 67676719,9820339204,,,,,Dr. M. V. Doshi  ,022 67676719 ,9820339204,bloodbank@sevenhillshospital.com,"MBBS, MD",Private,YES,YES,24x7,MH-004684 ,21-10-2010,20-10-2015,19.117797,72.87809
1419,Shushrusha Citizens Co-operative Hospital Blood Bank,Maharashtra,MUMBAI,Mumbai,"698-B Ranade Road, Dadar, Mumbai",400028,"022 24469579, 022 25288698",9022240366,,,,,Dr. Ajay Madhav Gode   ,"022 24469579, 022 24449162, 022 24449163, 022 24449164 (Extn. 354)",9022240366,shushrushahospital@gmail.com,"MBBS, MD",Charity,YES,,24x7,37-28C ,29-04-2002,Applied for renewal,19.023426,72.837899
1420,Sir J.J.Group of Hospital Blood Bank,Maharashtra,MUMBAI,Mumbai,"Main Building, Ground Floor, Sir J. J. Hospital, Byculla, Mumbai",400008,"022 23735555, 022 23739400 (Extn. 2248, 2238)",9322106373,,022 23735599 ,,http://www.gmcjjh.org,"Dr. Bharath Ghodke        ,","022 22621420, 022 22620242 (Extn. 1431, 1430, 1429)",9867993451,"dr_b_ghodke@yahoo.co.in, drkiranbendale@gmail.com, bb004@mahasbtc.com","MBBS, MD",Government,NO,NO,24x7,28-C-1107 ,19-10-2011 ,18-10-2016,18.962909,72.833639
1421,Sir J.J.Mahanagar Rakthapedhi,Maharashtra,MUMBAI,Mumbai,"Sir J.J Mahanagar Raktapedhi, F. D. Petit Building, J.J.Campus, J. J. Road, Byculla, Mumbai ",400008,"022 23735585, 022 23733531",8275001905,,022 23733338,,http://www.mahasbtc.com,Dr. Hitesh Pagare   ,022 23735585,9892860703,"shakti@mahasbtc.com, yogita@mahasbtc.com",MD (Pathalogy),Charity,YES,YES,24x7,,,,18.963334,72.832489
1422,Saint George&#39;s Hospital & Regional  Blood Bank,Maharashtra,MUMBAI,Mumbai,"Saint George&#39;s Hospital, Behind General Post Office, 
P. D&#39;Mello Road, Fort, Mumbai",400001,"022 22621420, 022 22620242 (Extn.1431)  ",9867993451,,022 22624464 ,,http://www.stgeorgeshospital.in,Dr. Bharath Ghodke          ,"022 22621420, 022 22620242 (Extn.1431,1430,1429)",9867993451,"dr_b_ghodke@yahoo.co.in, drkiranbendale@gmail.com, bb004@mahasbtc.com",MD (Pathalogy),Government,YES,,24x7,895,14-08-1997,Applied for renewal,18.94027,72.837319
1423,Tata Memorial Hospital Blood Bank,Maharashtra,MUMBAI,Mumbai,"5th Floor, Service Block, Dr. E. Borges Road, Parel, Mumbai ",400012,"022 24177000, 022 24127096 (Extn. 4682, 4684)",9820340073,,022 24146937  ,,http://www.tmc.gov.in,Dr. S. B. Rajadhyaksha  ,"022 24177000, 022 24127096",9820340073,"dtmtata@gmail.com, sunilrajadhyaksha@gmail.com ","MD(Pathalogy), DTM, PGDMLS",Government,YES,YES,24x7,239,30-01-1979,Applied for renewal,19.004856,72.842945
1424,The B.D. Petit Parsee General Hospital Blood Bank,Maharashtra,MUMBAI,Mumbai,"B.Petit Road, Cumballa Hill,  Mumbai",400036,"022 61186190, 022 61186192, 022 61186333",9323570506,,022 61186333,,,"Dr. Puja Pandey, Dr. Amin Ansari  ","022 23685350, 022 61186190, 022 61186191, 022 61186192","09769762009, 09987742263","bbincharge@bdppgh.org, bdppgh@mtnl.net.in, ceo@bdppgh.org","MBBS, MD",Charity,YES,,24x7,FDA-28-C/1081 ,6/5/2009,3/4/2014,18.968704,72.805743
1425,V. N. Desai Municipal General Hospital Blood Bank,Maharashtra,MUMBAI,Mumbai,"T. P. S. II, 11th Road, Santacruz (E) Mumbai",400055,"022 26182081, 022 357022, 022 26151506 (Extn.356, 357)",9820618132,,022 26151506 ,,,Dr. Jairaj Acharya ,"022 26182083 (Extn. 357,356)",9820618132,vndesaibloodbank@gmail.com,MBBS,Government,NO,NO,8.00am to 9.00pm (Sunday&#39;s & public holidays closed),30-28C ,1/1/2013,31-12-2017,19.078822,72.844994
1426,West Coast Blood Bank,Maharashtra,MUMBAI,Mumbai,"Basement 101, Moon Building, 798, Mori Road, Mahim(W), Mumbai",400016,022 24444544 ,9820721197,,022 24448899,westcoastbloodbank@gmail.com,,Dr. M.R. Laxman G. Prabhu,022 24444544,9820721197,westcoastbloodbank@gmail.com,MBBS,Private,YES,NO,24x7,FDA Lic No. 34 / 28C,24-01-2001,1/1/2013,19.042954,72.84073
1427,M/s. Balasaheb Thackerey Blood Bank,Maharashtra,MUMBAI,Mumbai,Mumbai,,,,,,,,,,,,,Private,,,,,,,19.0759837,72.8776559
1428,M/s. Pallavi Blood Bank,Maharashtra,MUMBAI,Mumbai,Mumbai,,,,,,,,,,,,,Private,,,,,,,19.0759837,72.8776559
1429,"ESI-PGIMSR, MGM Hospital Blood Bank",Maharashtra,MUMBAI,Mumbai,Mumbai,,,,,,,,,,,,,Government,,,,,,,19.0759837,72.8776559
1430,M/s Sion Blood Bank,Maharashtra,MUMBAI,Mumbai,Mumbai,,,,,,,,,,,,,Private,,,,,,,19.0759837,72.8776559
1431,Harkisandas  Marottamdas Hospital Blood Bank,Maharashtra,MUMBAI,Mumbai,Mumbai,,,,,,,,,,,,,Private,,,,,,,#N/A,#N/A
1432,Government Medical College Blood Bank Nagpur,Maharashtra,NAGPUR,Nagpur,"Model Blood Bank, 2nd Floor, Hospital Building, Government Medical College & Hospital, Nagpur  ",440003,0712 2744695,9822941695,,,gmchbbngp@gmail.com,,Dr. Sanjay Parate,0712 2744695,9822734640,gmchbbngp@gmail.com,MD (Pathalogy),Government,YES,NO,24x7,1005,24-05-1989,1/1/2018,21.126097,79.097101
1433,Super Speciality Hospital and Medical Post Graduate Institute Blood Bank,Maharashtra,NAGPUR,Nagpur,"Maenad Road, Near RST Cancer Hospital, Nagpur",440003,"0712 2703501, 0712 2746682",8275531628,,,,,Dr. A. N. Sardeshpande (Dixit),0712 2703501,8275531628,bshweta111@gmail.com,MD (Pathalogy),Government,NO,NO,24x7,ND/BB/15,15-03-1999,1/1/2018,21.123952,79.102367
1434,Indira Gandhi Medical College and Hospital Blood Bank,Maharashtra,NAGPUR,Nagpur,"IGMC Hospital, Central Avenue Road, Nagpur ",440018,"07122820134,0712 2728621, 0712 2774766",7709884278,,,igmc@rediffmail.com,,Dr. Sarda  ,0712 2728627,9371490334,igmc@rediffmail.com,"MBBS, MD (Pathology)",Government,YES,NO,24 Hours,983,7/3/1989,1/1/2018,21.153917,79.092894
1435,Daga Memorial Women Government Hospital Blood Bank,Maharashtra,NAGPUR,Nagpur,"Gandhibag, Nagpur",440002,"0712 2729202, 0712 2729333 ",9422762492,,,msdaga_WomenHosp@redifmail.com,,Dr. Sangita Mehata,0712 2729202,8308178609,"msdaga_womenhosp@rediffmail                                             0712-2729333(Hospital) 9422762492/8308178609(Dr.Mahata), 9422148686(Dr.Mangesh Kohale)   mehtasangeeta.234@gmail.com, , csnagpur@gmail.com",MD (Micro),Government,NO,NO,24 hours,ND/BB/23,14-06-2013,13-06-2018,21.151511,79.105434
1436,Central India Institute of Haematology & Oncology&#39;s Blood & Blood Component Bank and Apheresis Unit,Maharashtra,NAGPUR,Nagpur,"Plot No-14/2, Park Corner, Bal Raj Marg, Near Loma Square, Dhantoli, Nagpur",440012,"0712 2430038 , 0712 2428972 , 0712 6464198",9822723264,,,,,Dr. Surekha Avinash Pophali,0712 2430038,9822723264,pophali@sify.com,"MBBS, MD, DCH",Private,YES,YES,24 hours,ND/BB/23,3/9/2010,2/9/2015,21.134731,79.080223
1437,Jeevan Jyoti Blood Bank and Component,Maharashtra,NAGPUR,Nagpur,"J P Chamber, Madhav Nagar, Dakshin Ambakshari Road  Nagpur",440010,"0712 2231660,  0712 2230876",9422113811,,,jjbb21@hotmail.com,,Dr. Sheela S. Mundhada ,"0712 2231660, 0712 2230876",9422113811,jjbb21@hotmail.com,"MBBS, MD",Charity,YES,YES,24x7,ND/BB/11 (NGP/005),1/1/2008,Applied for renewal,21.123051,79.057149
1438,Dr. Hegdewar Blood Bank,Maharashtra,NAGPUR,Nagpur,"2, Sitaram Smruti, West High Court Road, Laxmibhuvan Square, Audumbar Apartment, Dharmpeth, Nagpur ",440010,"0712 2528292, 0712 2538900, 09922407171, 09881000203",9922407171,,,hbbnagpur687@gmail.com,,Dr. A. O. Pitale ,"0712 2528292, 0712 2538900, 0712 6542233",9922407171,hbbnagpur687@gmail.com,MBBS,Charity,YES,NO,24 hours,ND/26,23-03-1993,31-12-2017,21.140579,79.060505
1439,Sainath Blood Bank,Maharashtra,NAGPUR,Nagpur,"531,Jaiswal Building, Above R.K. Traders, Old shukrawari Road, Sakkardara Nagpur",440024,9422502066,9422502066,,,sainathbloodbank@gmail.com,,Dr. Achala Bhudhraja ,0712 2452035,9373335862,"vinodlimje11@gmail.com, sainathbloodbank@gmail.com",MD (Pathalogy),Charity,YES,NO,24 hours,ND/BB/21,17-01-2003,18-Jan,21.134294,79.076369
1440,Ayush Blood Bank and component Lab,Maharashtra,NAGPUR,Nagpur,"9th Floor, A wing, 901-905, 910-912, Lokmat Building, Nagpur",440010,"0712 6618666, 0712 5631137     ",9823051508,,,ayush_bbc@rediffmail.com,,Dr. D. S. Shende,"0712 6618666, 0712 5631137 ",9822471219,ayush_bbc@rediffmail.com,MD (Pathalogy),Charity,YES,NO,24 hours,ND/BB/27,22-01-2015,22-01-2020,21.135231,79.072978
1441,Lifeline Blood Bank Components and Apherisis Centre Blood Bank,Maharashtra,NAGPUR,Nagpur,"Neeti Gaurav complex , 2nd Floor, Central Bazar Road, Lokmat Square, Ramdaspeth, Nagpur ",400010,"0712 6686666, 0712 6686665",9552556425,,,drwarbhe@gmail.com,httpS://www.lifeline.com,Dr. Anita Deshkar,0712 6686625,9823051771,lifeline_nagpur@ rediffmail.com,MD (Pathalogy),Charity,YES,YES,24 hours,ND/BB/18,3/6/2000,1/1/2017,21.138999,79.063093
1442,Rainbow Blood Bank,Maharashtra,NAGPUR,Nagpur,"3rd Floor, 282, Rainbow Diagnostic Services Central Bazar Road, Ramdas Peth, Nagpur",440010,0712 6636666,9975844830,,,rainbowbloodbank.nagpur@gmail.com,,Dr. D. J. Sontakke ,0712 6636666,9975844830,rainbowbloodbank.nagpur@gmail.com,MD (Pathalogy),Charity,YES,NO,24 hours,ND/BB/20,,,21.133584,79.072736
1443,"NKP Salve Institute of Medical Science and Research Center (Lata Mangeshkar Hospital), Blood Bank",Maharashtra,NAGPUR,Nagpur,"5, YMCA Complex, Digdoh Hills, Hingna Road, Nagpur",440019,"07104 236290, 07104 236291, 07104 232905",9850448905,,,,,Dr. K. V. Bendekar,07104 306167,9850448905,dilipwankar16@gmail.com,MBBS,Charity,YES,NO,24x7,ND/BB/19,15-02-2002,14-02-2017,21.144346,79.078848
1444,Nandkishor Education Society Trust - Arpan Voluntary Blood Bank,Maharashtra,NAGPUR,Nagpur,Nagpur,,,,,,,,,,,,,Charity,,,,,,,21.1458004,79.0881546
1445,Dr. Shankarrao Chavan Government Medical College and Guru Govindsinghji Memorial Hospital Blood Bank,Maharashtra,NANDED,Nanded,"Vazirabad, Nanded ",,"02462 235711, 02462 235712, 02462 234702","09890172702, 09503007847, 09860127959",,,gmcbbnanded@gmail.com,,Dr. Deepak               ,02462 235711-18 (Extn. 309),9860127959,"sabaashraf@gmail.com, cs_nanded@rediffmail.com",MD (Pathalogy),Government,YES,YES,24x7,28 C/Ad/BB/004,29-09-1994 ,31-12-2016,19.109305,77.29295
1446,Indian Red Cross Society Blood Bank,Maharashtra,NANDED,Nanded,"Parsi Anjuman Complex, Vazirabad, Nanded      ",431602,"02462 236699, 02462 231012, 02462 236633, 02462 227335",9850947545,,,ircsnanded@gmail.com,,Dr. P. T. Rathod ,02462 236699,9552785833,ircsnanded@gmail.com,MD (Pathalogy),Charity,YES,,24x7,AD/020 ,12/1/1993,Applied for renewal,17.399811,78.485456
1447,Golvalkar Guruji Blood Bank,Maharashtra,NANDED,Nanded,"Plot No.2-12-407, Bandhaghat Road, Vazirabad, Nanded",431601,02462 243300,9822589088,,,,,,,,,,Charity,,,,,,,19.168646,77.326553
1448,Arpan Blood Bank,Maharashtra,NANDED,Nanded,"2nd Floor, Dayma Complex, Doctor Lane, Ghamodia,Nanded",431601,"02462 241587, 02452 239587",9881907646,,,,,,,,,,Charity,,,,,,,19.161084,77.303022
1449,Guru Gobindsinghji Blood Bank,Maharashtra,NANDED,Nanded,"Geeta Bhavan 1 & 2 Floor, House No 3-1-366, Near Government, Opposite to Ayurvedic College, Bus Stand Road, Vazirabad, Nanded          ",431601,02462 233332,9145432520,,,ggbloodbank@gmail.com,,Dr. Maya Prasad Borulkar ,02462 233332,9145432520,ggbloodbank@gmail.com,MBBS,Charity,YES,NO,24 hours,AD/BB/24,1/6/2012,31-05-2017,19.156029,77.309
1450,Nanded Blood Bank,Maharashtra,NANDED,Nanded,"Shivaji Nagar ,Opposite to Adhar Hospital, Nanded ",431602,02462 233810,9422382810,,,nandedbloodbank@gmail.com,,Dr. Anil Kabra  ,"02462 232810, 02462 692810 ",9422820292,nandedbloodbank@gmail.com,MD (Pathalogy),Charity,YES,,24x7,AD/BB/32 ,29-10-2013 ,28-10-2018,19.161264,77.304543
1451,Hazur Saheb Blood Bank,Maharashtra,NANDED,Nanded,"2nd Floor, Opposite to Bank of India, Sant Kripa Market, GG Road, Nanded ",431601,"02462 248888, 02462 239999","09689100000, 09960596860",,0246 2244948,shs.bloodbanknanded@gmail.com,,Dr. J. N. Dhape,"02462 248888, 02462 239999",9423432225,shs.bloodbanknanded@gmail.com,MD (Pathalogy),Charity,YES,,24x7,AD/BB/036  ,4/5/2014,4/5/2019,19.153093,77.318654
1452,Civil Surgeon - District General Hospital Blood Bank,Maharashtra,NANDURBAR,Nandurbar,"Nandurbar, Railway Station Road Survey No.406, Civil Hospital Compound,  Sakri Road, Near Collector Office Nandurbar  ",425412,"02564 202510, 02564 210135, 02564 226225, 02564 210122","09860408109, 09422238791",,,"rmochndb@gmail.com, dponandurbar@mahasacs.org",,Dr. Sudhir Desai                                        ,"02564 202510, 02564 210135, 02564 226225",9823270226,"rmochndb@gmail.com, dponandurbar@mahasacs.org, sudhir_desai2003@yahoo.com",MD (Pathalogy),Government,NO,NO,24x7,NKD/41,,,21.33867,74.234768
1453,Sahada Blood Bank - Shree Swami  Samartha Vaidyakiya  Shaikshanik and Sanshodhan Sanstha ,Maharashtra,NANDURBAR,Nandurbar,"C/o. 1st Floor, Shushrut Hospital, Khetiya Road, Survey 
No. 67/3, Plot No. 3, Sahada, Nandurbar",425409,,9371855918,,,bb_shahada@yahoo.com,,Dr. Navinchandra  Shah,9371855918,9823065094,bb_shahada@yahoo.com,MBBS,Charity,NO,NO,24x7,NKD/53 ,28-02-2013 ,27-02-2018,21.554798,74.472874
1454,Jankalyan Rakta Pedhi,Maharashtra,NANDURBAR,Nandurbar,"Nandurbar,1st Floor, Vivekanand Hospital, Desaipura, Nandurbar ",425412,"02564 226934, 02564 226935, 02564 222226 ",9096175855,,,jankalyanbbndb@gmail.com ,,Dr. Rajesh M. K.  ,02564 226934,9096175855,"drrajeshkeswani@gmail.com, jankalyanbbndb@gmail.com ",MD (Pathalogy),Charity,NO,NO,24x7,NKD/30 ,2/1/2005,31-01-2020,21.36433536,74.24463853
1455,Malegaon Blood Bank,Maharashtra,NASHIK,Malegaon,"2nd Floor, West End Complex, Satana Naka, Malegaon ",423203,,9371550550,,,"malegaonb@gmail.com, ",,Dr. Dilip G. Bhavsar,02554 252731,9823010095,malegaonb@gmail.com,MD (Pathalogy),Charity,YES,YES,24 Hours,NKD/51,29-03-2017,28-03-2022,20.55474,74.524396
1456,Seva Blood Bank,Maharashtra,NASHIK,MALEGAON,"Nilkanth Building, Satana Naka, Satana Road, Malegaon, Nashik",423203,02554 257077,"09823967555, 08805611555",,,sevabloodbankmalegaon@gmail.com,,Dr. Rajesh Bhanvar ,02554 321825,,sevabloodbankmalegaon@gmail.com,,Charity,YES,NO,24x7,NKD-22,24-01-2012,31-12-2016,20.552689,74.516643
1457,Roachabai Sugnomal Manwani - Cantonment General Hospital Blood Bank,Maharashtra,NASHIK,Nashik,"Vadner Road, Devlali, Nashik",422401,"0253 2493365, 0253 24913377,  0253 2462068","09850536784, 09404803045, 09420746965             ",,,,,,,,,,Government,,,,,,,19.903354,73.825824
1458,Metro Blood Bank - District (Civil) Hospital Nashik,Maharashtra,NASHIK,Nashik,"District - Civil Hospital Blood Bank, Near Thakkar Bazaar,  Trimbak Naka, Nashik",422001,"0253 2318020, 0253 2577949",9850536784,,,"civilbloodbanknsk@gmail.com, ",,"Dr. Pavankumar  Bardapurkar, Dr. Rajput D.P",0253 2318020   ,"09850536784, 09404803045, 09420746965, ","civilbloodbanknsk@gmail.com, pavanbardapurkar4@gmail.com, ashirsath07@gmail.com, cs_nashik@rediffmail.com",MD (Pathalogy),Government,YES,,24x7,NKD/992,4/4/1989,13-12-2020,19.996886,73.778198
1459,Sainik Aspatal Military Hospital Blood Bank,Maharashtra,NASHIK,Nashik,"Sainik Aspatal, Military Hospital, Deolali",,,9545355252,,,,,Dr. Anil Kaushik ,9404608661,9545355252,,MD (Pathology),Government,,,,,,,19.9483203,73.841866
1460,Ansar Blood Bank,Maharashtra,NASHIK,Nashik,"1398/1, Islampura, Industrial Society Compound, Quidwai Road, Malegaon, Nasik",423203,"02554 238383, 02554 230169, 02254 230039",9890353737,,,,,Dr. Gulab L. Mansuri,"02554 238383, 02554 230169",9890353737,dransarbloodbankmalegaon@rediffmail.com,,Charity,NO,,24x7,NKD/5,28-03-1995,31-12-2012,20.552043,74.532641
1461,Arpan Blood Bank and Blood Component Laboratory and Research Centre,Maharashtra,NASHIK,Nashik,"1st Floor, Office No.102/103, Dr. Athawale Chambers, Opposite to Gavkari Press Tilak Path, Nashik 
",422001,"0253 2311358, 0253 2576058","09822324340, 09422770765",,0253 2313662,,,Dr. Rajesh Kucheriya ,"0253 2311358, 0253 2576058","09822324340, 09422770765","nandkishor@arpanbloodbank.org,",MD (Pathalogy),Charity,YES,,24x7,NKD/8/96 & NKD/18/99,01-01-2007 & 01-01-2008,31-12-2011 & 31-12-2012,20.004874,73.787164
1462,Jankalyan Blood Bank,Maharashtra,NASHIK,Nashik,"3, Shree Nagar, Old Gangapur Naka, Gangapur Road, Nashik
",422013,"0253 2573493, 0253 2575249",9823114809,,0253 2313722,rssjan_nsk@rediffmail.com,,Dr. Sapana Merchant,"0253 2573493, 0253 2575249",9823114809,"rssjan_nsk@rediffmail.com,","MBBS, MD (Pathalogy)",Charity,YES,YES,24x7,NKD/33,14-09-2006,13-09-2016,20.008838,73.7702
1463,NDMVPS Medical College and Hospital Blood Bank,Maharashtra,NASHIK,Nashik,At Post Adgaon Dist Nashik ,,"0253 2220522, 0253 2303930",9422237694,,,,,Dr. Mrs. Archana Patil (Ukey)                                                                                                                                                                                    ,0253 2220522,9422237694,,,Charity,YES,,24x7,NKD/316,1/1/2009,,20.037363,73.852998
1464,Samta Blood Bank,Maharashtra,NASHIK,Nashik,"F-1, 1st Floor Suyojit Comercial Complex, Mumbai Agra Highway, Below Data Mastics, Mumbai Naka, Nashik 
",422001,"0253 2472499, 0253 2472599, 0253 2472699, 09975997867, 09975997863, 09975997864",9975997867,,0253 2504399 ,samtabloodbank@gmail.com,,Dr. Irfankhan ,"0253 2472499, 0253 2472599, 0253 2472699, 09975997867, 09975997863, 09975997864",9975997867,devassamta@gmail.com ,,Charity,YES,YES,24x7,NKD 40,21-08-2010,20-08-2013,19.984791,73.782607
1465,Sanjeevani Blood Bank,Maharashtra,NASHIK,Nashik,"Nashik, Krushna-Chaya Bangla, Plot No. 10/11, Kurdukar Nagar, Behind Fame Theatre, Nashik Pune Road, Nashik ",422006,0253 2411888  ,"09730733888, 09370355501",,,,,Dr. Pradeep Nikumbh,0253 2411888 ,9372811919,"sanjeevani.bb@gmail.com,",,Charity,,,24x7,NKD/43,3/3/2011,27-02-2016,19.975586,73.803963
1466,Jijau Mahila Sevabhavi Sansthan Nashik Blood Bank and Transfusion Research institute Blood Bank,Maharashtra,NASHIK,Nashik,"Ishwar Krupa Ganesh Nagar, Tidke Colony, Nashik ",,0253 2232996,9890609318,,,,,,,,,,Charity,,,,,,,19.990656,73.775241
1467,The Santajee Educational and Medical foundation Trust - Jeevan  Blood Bank ,Maharashtra,NASHIK,Nashik,"Suyojit City Center, G-11, 12, 13, S. No. 567/1/1 & 567/1/3 (CTS No. 7249 & FP No. 60) Mumbai Naka, Near Mahamarg Bus Stand, Nashik 
",,7387348888,,,,,,Dr .Rajesh Madanlal Kucheria ,0253 2508777,9823025292,"jeevanbloodnashik@gmail.com,","MBBS, DCP",Charity,YES,,24x7,NKD/54,14-05-2013,13-05-2018,19.987781,73.784138
1468,SMBT Institute of Medical Science and Research Centre - Blood Bank and Component,Maharashtra,NASHIK,Nashik,"SMBT Institute of Medical Science & Research Centre, Blood Bank & Component,  Block-101, Ground Floor, ?A? Wing, New SMBT Hospital Building, Survey No. 470, Nandihills Appt., At Post-Dhamangaon, Ghoti, Igatpuri, Nashik
",422002,02553 222300,9011067101,,,,,Dr. Gaware Rajashree Rajendra ,02553 222300,9011067101,"bloodbank@smbt.edu.in,",MD (Pathology),Charity,YES,,24x7,NKD/56,21-02-2014,20-02-2019,19.76062,73.769851
1469,Hindustan Aeronautics Limited Blood Bank,Maharashtra,NASHIK,Nashik,"HAL, Aircraft Division, HAL, In Front of GES HAL High School, Ojhar Township, Niphad, Nashik
",,"02550 275845, 02550 278932 (Extn. 2589)",9420592940,,,,,Dr. Bubun  Biswas ,"02550 275845, 02550 278932 (Extn. 2589)",9420592940,"medical.nsk@hal_india.com,   dr_biswas@rediffmail.com",MBBS,Government,NO,,24x7,NKD/37,22-01-2010,21-01-2015,20.105897,73.931932
1470,J.D.C. Bytco Hospital Blood Bank,Maharashtra,NASHIK,Nashik,"1st Floor, Bytco Hospital, Nashik Road, Behind Durga Garden, Shahu Path, Nashik",422101,"0253 2460251, 0253 24605352",,,,,,Dr. S. V. Nayak,,9860268411,,"MD, DVD",Government,NO,NO,,NKD/5,30-12-1992,31-12-2016,19.949132,73.838742
1471,Regional Referal Hospital Blood Bank,Maharashtra,NASHIK,Nashik,"Medical Superintendent, Regional Referal Hospital (Superspeciality Hospital) Blood Bank, Nashik",,,,,,,,,,,,,Government,,,,,,,#N/A,#N/A
1472,Shri Krishna Blood Bank,Maharashtra,OSMANABAD,Omerga,"Dr. Patange Hospital Building, Ajay Nagar Omerga, Omerga,  Osmanabad  ",413606,"02457 252004, 02457 252232, 02457 252469",9422069904,,,dr.dbpatange@yahoo.com,,Dr. Damodar B. Patange    ,02457 252004,9422069904,dr.dbpatange@yahoo.com,"MS, FICS",Charity,YES,NO,24x7,AD/BB/003 ,10/8/1996,31-12-2016,17.83503,76.622149
1473,"Civil Surgeon, General Hospital Blood Bank",Maharashtra,OSMANABAD,Osmanabad,"Civil Hospital Osmanabad, Tqand, Osmanabad ",413501,02472 226924,,,,"bloodbankosmanabad@gmail.com, cs_osmanabad1@rediffmail.com",,"Dr. S. M. Sable, Dr. Gore & Dr. Deshpande   ",02472 226355,"08605624488, 09421352152, 09970702414","ksprbhaskar@gmail.com, bloodbankosmanabad@gmail.com, cs_osmanabad1@rediffmail.com ",MD (Pathalogy),Government,YES,YES,24x7,28-1026 ,17-09-2012 ,31-12-2017,18.18077,76.034735
1474,Civil Surgeon - District General Hospital Blood Bank,Maharashtra,PARBHANI,Parbhani,"Blood Bank Civil Surgeon, District General Hospital Blood Bank, Subhash Road, Parbhani
",414001,"02452 223458, 02452 231287",9422176541,,,bloodbankghp@gmail.com,,"Dr. Rubina, Dr. Busawad",02542 223458,"09881517607, 09764005507","dmhpparbhani@gmail.com, cs_parbhani@rediffmail.com, bloodbankghp@gmail.com",MD (Pathalogy),Government,YES,,24x7,28-c/AD/BB/005  ,11-Dec,16-Dec,19.271699,76.765032
1475,Kanthak Sevabhavi Sanstha - New Life Blood  Bank,Maharashtra,PARBHANI,Parbhani,"Plot No 22, Survey No 389 and 394, Beside Gurudwara, Station Road, Parbhani ",431401,02452 220222,"09823093235, 09822642102",,,newlifebloodbank@gmail.com,,Dr. Vikas Dharmadhikari   ,02452 220222,8007773377,newlifebloodbank@gmail.com,"MBBS, MD",Charity,YES,,24x7,AD/BB/30  ,7/2/2013,7/1/2018,19.273124,76.782625
1476,Indian Red Cross Society Blood Bank,Maharashtra,PUNE,Baramati,"Indian Red Cross Society (IRCS), (Late Manikbai Chandulal Saraf) Blood Bank, Near Government Silver Jubilee Hospital, Patas Road, Baramati, Pune",413102,02112 222951,9850033891,9096383959,,ircsbbbaramati@gmail.com,,Dr. D. N. Dhawade,"02112 222951, 02112 320910",9850033891,"ircsbbbaramati@gmail.com,",MBBS,Charity,YES,,24 Hours ,7269/(FORM-28),1/1/2012,31-12-2016,18.152597,74.574996
1477,Pune Chest and General Hospital Blood Bank,Maharashtra,PUNE,Pune,"Aundh Cest Hospital, Aundh Camp, Pune",411027,"020 27285432, 020 27286458","09422780176, 09604871471",,,,,Dr. C. G. Kalale  ,020 27285432   ,9922688829,"csaundhpune@yahoo.co.in, powar.vijaykumar@yahoo.co.in, sangeetagkwd@gmail.com, balabrathod@gmail.com","MBBS, MD",Government,NO,NO,10am to 5pm,862,16-01-1987,Applied for renewal,18.575032,73.80537
1478,Sasoon Sarvopchar Hospital Blood Bank,Maharashtra,PUNE,Pune,"Ground Floor, Section 5, Opposite to Central Medical Stores, Station Road, Pune",411021,"020 26126868, 020 24480431",9423575986,,,bjmc.bloodbank@gmail.com,http://www.sasoonhospitalpune,Dr. Nakate Leena Ashok,020 26128000,9423575986,"bjmc.bloodbank@gmail.com, bjmcbloodbank@gmail.com",MD (Pathology),Government,YES,NO,24 hours,963,1/1/2012,31-12-2016,18.515846,73.858714
