Sr No, Blood Bank Name, State, District, City, Address,Pincode, Contact No, Mobile, Helpline, Fax, Email, Website, Nodal Officer , Contact Nodal Officer, Mobile Nodal Officer, Email Nodal Officer, Qualification Nodal Officer, Category, Blood Component Available, Apheresis, Service Time, License #, Date License Obtained, Date of Renewal, Latitude, Longitude
1,G.B. Pant Hospital Blood bank,Andaman And Nicobar Islands,SOUTH ANDAMAN,Port Blair,"Atlanta Point
Near Cellular Jail
P.O. Aberdeen Bazaar
",744104,03192 230628,9434266561,102,N/A,bbgbpant@gmail.com,,Dr.Ganesh Samaddar,03192 230628,9434266561,ganeshsamadder7@gmail.com,,Government,YES,NO,24X7,DL1/CLAA/ANI,14.6.1996,01.01.2012,11.675442,92.747338
2,I.N.H.S. Dhanvantri,Andaman And Nicobar Islands,SOUTH ANDAMAN,Port Blair,"Ashvini Nagar, Port Blair, Andaman and Nicobar Islands.",744103,03192 248759,8001452200,N/A,N/A,,,Dr.Smiriti Mathur,03192 248759,8001452200,mesmriti@yahoo.com,"MBBS, MD (Pathology)",Government,NO,NO,24X7,DL2/CLAA/ANI,14.06.1996,31.12.2016,11.649693,92.717418
3,Pillar Health Centre Blood Bank,Andaman And Nicobar Islands,SOUTH ANDAMAN,Port Blair,"Lamba Line,
P.B. 526,
P.O. Junglighat, 
Opposite Airport",744104,"03192 233193, 03192 233993",9474247585,03192 233193,N/A,pillarbloodbank2016@gmail.com,,Dr. Sr. Cross Mary,"03192 233193, 03192 233993",9474247585,crossgracy2003@yahoo.co.in,"MBBS, MD (Medicine)",Charity,NO,NO,24X7,DL3/CLAA/ANI,08.09.2010,10.06.2015,11.653229,92.730714
4,"Indian Red Cross Society Blood Bank, District Branch",Andhra Pradesh,ANANTAPUR,Anantapur,"Near JNTU Engeneering College, Sarada Nagar, Ananthapur.",515002,08554 246344,9441192365,NA,08554 246344,NA,,Dr.G. Parvathi & Dr.G. Ramanjaneyulu Naidu,NA,"09441125444, 09440286555",ircsbloodbank.anantapur@gmail.com,"MBBS, MD, DCP",Charity,YES,NO,24x7,13/ATP/AP/2005/BB/R,22.11.2005,21.11.2015,14.654936,77.609915
5,Government General Hospital Blood Bank,Andhra Pradesh,ANANTAPUR,Ananthapur,"Government General Hospital, Ananthapur",515001,08554 275024,9866695858,NA,NA,bloodbankgghatp@gmail.com,,Dr. Shiva kumar & Dr. Swapna ,08554 275024,"09866695858, 09912938380",bloodbankgghatp@gmail.com,"MBBS, MD (Pathology)",Government,YES,NO,24x7,50/ATP/AP/97/BB/R,28.01.1997,01.01.2013,14.671459,77.596684
6,Indian Red Cross Society,Andhra Pradesh,ANANTAPUR,Ananthapur,"Blood Bank Medical Officer,Blood Bank, Indian Red Cross Society, Anantpur",515001,8554246344,Dist.Secretary 9866023293,,,ircsbloodbank.anantapur@gmail.com,,,,,,,Charity,YES,NO,24x7,,,,14.681888,77.600591
7,Rural Development Trust Hospital Blood Bank,Andhra Pradesh,ANANTAPUR,Bathalapalli,"Kadiri Road, Bathalapalli, Ananthapur",515661,08559 244259,9493268861,NA,NA,NA,,Dr. Hariharanadha Sharma,NA,9177155517,syanakishore@yahoo.co.in,MD (Pathology),Charity,YES,NO,24x7,13/AT/AP/2003/BB/R,28.08.2003,Renewal under Process,14.652907,77.618826
8,South Central Railway Hospital Blood Bank,Andhra Pradesh,ANANTAPUR,Guntakal,"S.C. Railway Hospital, Guntakal, Ananthapuramu",515801,08552 227166,9701374501,NA,NA,NA,,NA,NA,NA,"scrhbloodbank@gmail.com					",NA,Government,NO,NO,24x7,79/AT/AP/97/BB/G,28.01.1997,NA,15.172889,77.366103
9,Indian Red Cross Society Blood Bank,Andhra Pradesh,ANANTAPUR,Hindupur,"Government General Hospital Blood Bank, Hindupur, Ananthapur
",515201,08556 225900,NA,NA,NA,ircshup@gmail.com,,Dr. M. Satyam,9490978739,9490978739,ircshup@gmail.com,MBBS,Charity,NO,NO,24x7,"01/ATP/AP/2011/BB	",07.04.2011,06.06.2015,13.832533,77.492214
10,Indian Red Cross Society Blood bank RCH -II KADIRI,Andhra Pradesh,ANANTAPUR,Kadiri,"Ground Floor, APVVP (Government General Hospital) Area Hospital, Kadiri, Ananthapur
",515591,08494 221544,9989738689,NA,NA,kadiriircs@gmail.com,,"Dr. G. P. Subbrayudu	",NA,9989738689,kadiriircs@gmail.com,"MBBS, Diploma in Dermatology",Government,NO,NO,24x7,"ATP/AP/2008/BB/G	","16.07.2008	",15.07.2013,14.113089,78.157366
11,S.S.S.I.H.M.S. Blood Bank,Andhra Pradesh,ANANTAPUR,Puttaparthy,"Prasanthigram, Puttaparthy, Ananthapuramu",515134,08555 287900,9490360321,NA,NA,saikiran_ptp@yahoo.co.in,,Dr. Sai Kiran,NA,9490360321,sssihmspg@gmail.com,MBBS,Government,,,24x7,,,,14.151889,77.77685
12,District Head Quarters Hospital Blood Bank. ,Andhra Pradesh,CHITTOOR,Chittoor,"Head Quarters  Hospital Compound, Chittoor",517001,NA,9849229482,NA,NA,bloodbankctr1@gmail.com,,Dr. K. Babu Rajendra Prasad,NA,9849229482,bloodbankctr1@gmail.com,MBBS MD (Dermatology),Government,YES,NO,24x7,53/CPR/AP/1997/BB/R,27.01.1997,31.12.2017,13.217176,79.100329
13,Indian Red Cross Society,Andhra Pradesh,CHITTOOR,Chittoor,"The Secretary, Indian Red Cross Society, D:No:20-119, PH Road, Redcross Building, Chittoor 517 001, Andhra Pradesh Dr.M.V.Narayana Reddy (MO), Ph:08572 220287",517001,8572220287,,,,indian red cross society indian red corss society ,,,,,,,Charity,YES,NO,24x7,,,,13.217176,79.100329
14,M/s IRCS Blood Bank.,Andhra Pradesh,CHITTOOR,Chittoor,"D.No. 20 - 119, Prakasam High Road, Chittor",517001,08572 220287 ,9849229482,NA,NA,ircschittoor@gmail.com,,"Dr. M. V. Narayana Reddy	",NA,8019383106,ircschittoor@gmail.com,"MBBS, DO",Charity,NO,NO,24x7,"17/CT/AP/2002/BB/R		",16.12.2002,01.01.2013,13.21698,79.100764
15,M/s PESIMSR Blood Bank.,Andhra Pradesh,CHITTOOR,Kuppam,"PES Institute of medical sciences premises, Kuppam
",517425,08570 256737,9391833741,NA,08570 257200,pathpesimsr@gmail.com,,Dr. B. M. Prasanth ,NA,9391833741,pathpesimsr@gmail.com,"MBBS, MD (Pathology)",Private,YES,NO,24X7,8/CP/AP/2003/BB/R,25.06.2003,25.06.2018,12.791223,78.363897
16,Blood Bank AH Madanapalli,Andhra Pradesh,CHITTOOR,Madanapalli," The Blood Bank Medical Officer, Area Hospital, Patel Road, Madanapalli 517 325, Chittoor Dist. , Andhra pradesh Dr.Laxmiprasadreddy9(M.O)",517325,8571222087, ,,,  ircsbbmpl2009@gmail.com,,,,,,,Charity,YES,NO,24x7,18/CT/AP/2009/BBG,,,13.217176,79.100329
17,"Indian Red Cross Society, Madanapalli RCH 2",Andhra Pradesh,CHITTOOR,Madnapalli,"Area Hospital, Patel Road, Madanapalli.
",517325,08571 222087,9440580272,NA,NA, ircsbbmpl2009@gmail.com,,Dr. P. Radhakrishna Reddy,NA,9440580272, ircsbbmpl2009@gmail.com,MBBS,Government,NO,NO,24X7,18/CP/AP/2009/BB/G,22.04.2009,21.04.2014,13.556927,78.50085
18,"Aswini Hospital Blood Bank, TTD",Andhra Pradesh,CHITTOOR,Tirumala,"Tirumala Tirupati Devastanam (TTD), Tirumala, Chittoor ",517507,9490651605,9490651605,,,suresh.bandapalli@gmail.com,,,,,,,Charity,,,24x7,,,,13.677292,79.3487
19,SVRRGGH - Model Blood Bank,Andhra Pradesh,CHITTOOR,Tirupati,"S.V.R.R. Government General Hospital, Tirupati
",517502,0877 2286290,NA,NA,0877 2286290,modelbloodbanktpt2010@gmail.com,,Dr. L.Krishna,NA,9848369221,,"MBBS, MD (Pathology)",Government,YES,NO,24x7,18/CT/AP/95/BB/CP,12.09.2011,09.10.2016,13.644382,79.407003
20,Sri Venkateswara Institute of Medical sciences Blood Bank,Andhra Pradesh,CHITTOOR,Tirupati,"Sri Venkateswara Institute of Medical Sciences (SVIMS) Campus, Tirupati",517507,0877 2287777,,,0877-2286116,svimshosp ,,,,,,,Charity,,,24x7,,,,13.637934,79.403917
21,Govt Maternity Hospital Blood Bank,Andhra Pradesh,CHITTOOR,Tirupati,"Ruia Hospital Road, Tirupati",517507,,9949190197,,8772230367,supdtgmhtirupati@yahoo.com,,,,,,,Government,NO,NO,24x7,,,,13.639418,79.409372
22, TTD Central Hospital Blood Bank,Andhra Pradesh,CHITTOOR,Tirupati,"Tirumala Tirupati Devastanam (TTD), Kapil Teertham Road, Tirupati
",517501,0877 2264622,9849099750,NA,NA,ttdcentralhospital@gmail.com,,"Dr. J. Padmaja, Dr. R. V. S. Muralidhar ",8772264623,9959905559,ttdcentralhospital@gmail.com,MBBS,Charity,NO,NO,24x7,85/CH/AP/BB/1997/R,"07.07.1997	",01.01.2018,13.642148,79.421067
23,S.V.S. Charitable Trust Blood Bank and Transfusion Centre,Andhra Pradesh,CHITTOOR,Tirupati,"10-13-514, 1st Floor, Reddy & Reddy Colony, Tirupathi",517501,0877 6667671 ,9246999571,,,svsctbloodbank@gmail.com,,,,,,,Charity,YES,YES,24 hrs,,,,#N/A,#N/A
24,Government Hospital,Andhra Pradesh,EAST GODAVARI,Amalapuram,"Blood Bank Medical Officer,  Blood Bank, Government Hospital, Amalapuram",533201,,9989106236,,,bloodbankahamp@gmail.com,,Dr. G. KARNAL RAJU,9989106236,9989106236,bloodbankahamp@gmail.com,,Government,NO,NO,24x7,,,,16.587432,82.008431
25,"M/S. Kims & Research Foundation, Hospital Blood Bank",Andhra Pradesh,EAST GODAVARI,Amalapuram,"Kims & Research Foundation, Hospital Blood Bank, Sy.No:813 & 817, Kamanagaruvu, Near Red Bridge, Amalapuram.",533201,"08856 237996, 08856 237997, 08856 237998",9949993495,NA,08856 237985,Principal07kims@yahoo.co.in,,"Dr. E. Sanjeev Rao, Dr. P. Subba Rao	",NA,"07702998542, 09440542842	",kimsbbampeg@gmail.Com,"B.Sc, MBBS, MD (Pathologist), ",Charity,YES,NO,24x7,5/EG/AP/2004/BB/R,"27.05.2004			",26.05.2019,16.592169,82.024025
26,M/s. A.P.V.V.P Area Hospital Blood Bank  ,Andhra Pradesh,EAST GODAVARI,Amalapuram,"Ground Floor Area Hospital, Amalapuram",533201,NA,"09505152234, 09491219991",NA,NA,NA,,"Dr. G. Karnal Raju		",NA,"09989106236	","bloodbankahamp@gmail.com	","MBBS, DLO",Government,NO,NO,24x7,8/EG/AP/2006/BB/G,28.08.2006,28.08.2019,16.575367,81.998101
27,"M/s. Government General Hospital, Blood Bank.",Andhra Pradesh,EAST GODAVARI,Kakinada,"Government General Premises, Ground Floor, Kakinada",533001,0884 2302008,9390207027,,0884 2358474,bloodbankgghkkd@gmail.com,,Dr. K. Satyavani,9390207027,,drsatyavani@yahoo.co.in,,Charity,YES,,24x7,,,,16.955537,82.22748
28,M/s. Indian Red Cross Society Blood Bank,Andhra Pradesh,EAST GODAVARI,Kakinada,"D.No: 8-14-39, Ground & 1st  Floor, Red Cross Street, Gandhi Nagar, Kakinada",533004,0884 2385800,9848071868,NA,NA,nraopydah@yahoo.co.in,http://www.Indianredcross-eg.org,"Dr. Nageswar Rao				",NA,9848071868,redcrossbloodbank@yahoo.com,"MBBS, DCP",Charity,YES,YES,24x7,"14/EG/AP/2003/BB/G				",02.09.2003 ,28.08.2018,16.989065,82.247465
29,M/s. Rotary Blood Bank (Rotary Club Golden Jubilee Charitable Trust),Andhra Pradesh,EAST GODAVARI,Kakinada,"Second Floor, D.No:15-8-3, Brahmarishi Road, Satya Prasanna Nagar, Kakinada
",533001,"0884 2367366, ",9494673434,NA,NA,NA,,Dr. P. Kamaraju,NA,"09848620802			",rotarybloodbank.kakinada@gmail.com,MBBS,Charity,NO,NO,24x7,148/EG/AP/2000/BB/,"07.03.2001	",15.03.2019,16.955721,82.2384023
30,District Headquarters Hospital,Andhra Pradesh,EAST GODAVARI,Rajahmundry,"Blood Bank Medical Officer, Blood Bank, District Headquarters . Hospital, Rajahmundry",533101,,9849520969,,,govtbloodbank.rjy@gmail.com,,,,,,,NA,,,24x7,,,,17.019708,81.791631
31,M/s. G. S. L. Medical College General Hospital Blood Bank,Andhra Pradesh,EAST GODAVARI,Rajahmundry,"No-16, Lakshmi Puram, Rajanagaram, Rajahmundry.",533296,0883 2484999,,,0883 2484888,,,,,,gslbloodbank@gmail.com,,Private,YES,NO,24 Hours,,,,17.0665153,81.8828986
32,"M/s. Swatantra Hospital,  Blood Bank",Andhra Pradesh,EAST GODAVARI,Rajahmundry,"D.No: 46-13-31,1st Floor, Gowthami Scan Centre Private Limited, Near Gandhi Park,  Danaviepeta, Rajahmundry.",533103,"0883 2464745, 0883 246569878, 0883 2461493",NA,NA,NA,NA,,"Dr. M. C. Ramesh	",NA,"09642359555		",swantantrabbrjy@gmail.com,MBBS,Private,NO,NO,"24x7			","127/EG/AP/98/BB/R	",21.01.1992,04.12.2018,#N/A,#N/A
33,M/S. Dhanwantari Voluntary Blood Bank.,Andhra Pradesh,EAST GODAVARI,Rajahmundry,"D.No:46-21-1,2nd Floor, Danavaiepeta, Rajahmundry",533103,0833-2473050,9885186533,NA,NA,dvbbrjy@gmail.com,,"Dr K Srinivasa Murthy		",NA,"9949003311	",rjydvbb@gmail.com,MBBS MD Microbiology; Diploma In medical Virology,Charity,YES,YES,"24x7	","4/EG/AP/2007/BB/G	",16.03.2007,15.03.2017,17.00787,81.785213
34,M/s. Government Area General Hospital Blood Bank.,Andhra Pradesh,EAST GODAVARI,Tuni,"M/s.Government Area Hospital Blood Bank, Area hospital, Tuni
",533401,08854 252333,"09849030908, 09505615556",NA,NA,tunibloodbank@yahoo.com,,Dr. C. Salmon raj,8854252333,"09849030908		",tunibloodbank@yahoo.com,"MBBS, DCP",Government,NO,NO,24x7,"14/EG/AP/2009/BB/G			",04.09.2009,03.09.2019,17.354937,82.541241
35,M/s. Sakthi Voluntary Blood Bank (Sakthi Association for Social Awarness),Andhra Pradesh,EAST GODAVARI,Tuni,"D.No: 3-5-9, Opposite to Raithu Bazar, Lalam Satyanarayana Hospital Street, Tuni
",533401,08854 251123,"09347911130, 09948456739","NA			",NA,NA,,Dr. D. Ratnalal Naik,NA,9494952186,"sakthibloodbank@gmail.com	",MBBS,Charity,NO,NO,"24x7	","16/EG/AP/2009/BB/G			",28.08.2009,28.08.2019,#N/A,#N/A
36,Government General Hospital Blood Bank,Andhra Pradesh,GUNTUR,Guntur,"Opposite to Railway Station, 1st Floor, C/o Government General Hospital, Guntur.
",522001,0863 2220035 (Ext No: 280),9966641474,NA,NA,bloodbank.ggh.gnt@gmail.com,,"Dr. Anasuyamma, Dr. Maruthi Devi 					",NA,"09966641474, 09963229506",bloodbank.ggh.gnt@gmail.com,"MBBS, MD (Pathology)",Government,YES,NO,"24x7	",81/GNT/AP/97/BB/R,9.03.1997,"31.12.2016	",16.299747,80.443689
37,Indian Red Cross Society,Andhra Pradesh,GUNTUR,Guntur,"Blood Bank Medical Officer, Blood Bank, Indian Red Cross Society, Guntur, District Guntur",522004,,9985322589,,,redcrossbloodbankguntur@yahoo.co.in,,,,,,,Charity,YES,NO,24x7,,,,16.306653,80.43654
38,Indian Red Cross Society Blood Bank ,Andhra Pradesh,GUNTUR,Guntur city,"Zilla Parishad Compound, Nagarampalem, GUNTUR
",522004,0863 2215656,"09848181601, 08121751295	",NA,"NA							",NA,,"Dr. Y. Prabhavathi	",NA,9985322589,redcrossbloodbankguntur@yahoo.co.in,MBBS,Charity,NO,NO,"24x7	",15/GN/AP/2005/BB/G,23.01.2006,22.01.2011,16.306653,80.43654
39,Lions Club of Guntur Vision Blood Bank,Andhra Pradesh,GUNTUR,Guntur city,"1st Floor, Somuvari Street, Kothapeta, Guntur",522001,"0863 2336198, 0863 2336199 ",9246600777,,,,,Mr. Srinivas (Project Director)           ,,9440262674,lionsvisionbloodbank@gmail.com,,Charity,YES,,,,,,16.2992824,80.4503521
40,Padmavathi Day & Night Blood Bank,Andhra Pradesh,GUNTUR,Guntur city,"Opposite to Head Post Office, Behind Veterinary Hospital, Kothapeta ",522001,,,,,,,Dr. V. V. Subba Rao,,9394110333,"prabhudasmahe2@gmail.com,Drvvsra36@yahoo.com",,Private,YES,,,,,,16.3032412,80.4382196
41,M/s. Needs Blood Bank ,Andhra Pradesh,GUNTUR,Guntur city,"1st Floor, Honda Show Room Building, Opposite Doctor Plaza, Kothapeta
",522001,"0863 6638222, 0863 6639222",9246448899,NA,NA,needsbloodbankguntur@gmail.com,,"Dr. Sivaram Prasad, Dr. Kishore 		",NA,9246448899,srineeds@gmail.com,MBBS ,Charity,YES,YES,24x7,07/GN/AP/2008/BB/G,"23.06.2008	","23.06.2018 	",16.29882,80.448888
42,M/s. Sri Lakshmi Maternity & Surgical Nursing Home Blood Bank ,Andhra Pradesh,GUNTUR,Guntur city,"4th Floor, Behind Sivalayam Temple, Kothapeta
",522001,0863 2219955,,,,,,,,,Srilakshmibloodbank@gmail.com,,Private,YES,,,,,,#N/A,#N/A
43,Saint Joseph General Hospital Blood Bank,Andhra Pradesh,GUNTUR,Guntur city,"Opposite to Andhra Christian College, Near Flyover, Main Road, Guntur
",522001,"0863 2322700, 0863 2320386 ",9493819977,NA,NA,NA,,Sr. Dr. Any,NA,9441065463,Stjh_gnt@yahoo.com,"MBBS, DGO",Charity,NO,NO,"24x7				",92/GNT/AP/97/BB/R,"17.07.1997	",01.01.2018,16.297514,80.440648
44,NTR Memorial Trust Blood Bank,Andhra Pradesh,GUNTUR,Guntur city,"Door No. 13-2-87, 1st Line G. V. Thota",522001,0863 2339444 ,,,,,,Mr. Sashi Dhar (Manager)    ,9032005616,,gtrbb@ntrtrust.org,,Charity,YES,,,,,,16.2968931,80.4499274
45,Katuri Medical College and Hospital Blood Bank ,Andhra Pradesh,GUNTUR,Guntur Rural,"Katuri Nagar, Chinakondrupadu, Guntur
",522019,"0863 2288555, 0863 2288556 (Ext No. 234) ",NA,NA,NA,katuribloodbank@gmail.com,,Dr. T. Mahathi.,NA,9160983595,katuribloodbank@gmail.com,MD (Pathology) ,Private,YES,NO,"24x7	",15/GN/AP/2003/BB/G,30.09.2003,"30.09.2018	",16.227872,80.30947
46,NRI Medical College and General Hospital Blood Bank,Andhra Pradesh,GUNTUR,Guntur Rural,"Mangalagiri Mandalam, Chinakakani, Guntur
",522503,"08645 236777, 08645 237401, 08645 230101","09849989813, 09849989843",NA,NA,NA,,"Dr. K. M. N. Prasad	",NA,9849948887,bloodbanknri@yahoo.com,"MBBS, DCP",Private,YES,NO,24X7,11/GN/AP/2003/BB/CP,"18.07.2003			",03.04.2015,16.413675,80.555675
47,Manipal Hospital Bloodbank,Andhra Pradesh,GUNTUR,Guntur Rural,"Soumyanagar, Tadepalli, Guntur",522501,0866 2489700 (Ext No.102),NA,NA,0866 2498400,NA,http://www.manipalhospital.org,Dr. C. Sita Latha,NA,9440108197,c.sitalatha@yahoo.com,"MBBS, MD (Pathology) ",Private,YES,YES,"24x7	",24/GN/AP/2009/BB/G,"29.10.2010			",28.10.2015,16.484433,80.617219
48,Indian Red Cross Society Blood Bank. Narassraopet,Andhra Pradesh,GUNTUR,Narasaraopeta,"Area Hospital, Narasaraopeta ",522601,8647224455,"09885222155, 09885838866",08647 224455,,nrtbloodbankircs@gmail.com,,Dr. Babu Reddy ,9885222155,9885222156,ntrbloodbankircs@gmail.com,,Charity,NO,,24x7,,,,16.235919,80.048412
49,NRT Blood Bank,Andhra Pradesh,GUNTUR,Narasaraopeta,"GBR Super Speciality Hospital, 10-1-10/1, Palnadu Road, Narasaraopeta
",522601,9542628888,9985148884,NA,NA,nrtbioodbank@gmail.com,,"Dr. K. Priyanka 	",NA,7799822212,nrtbloodbank@gmail.com,"MBBS, DA",Private,YES,YES,24X7,04/GNT/AP/2014/BB/G,"07.01.2015			",06.01.2020,16.193331,80.019956
50,Anjireddy Multi Specality Blood Bank ,Andhra Pradesh,GUNTUR,Piduguralla,"Gaganamma Temple, Piduguralla
",522413,08649 254567,9849212042,NA,NA,NA,,Dr. C. C. Subba Rao,NA,8332812042,athotasunilkumar@gmail.com,MBBS,Private,YES,NO,24X7,03/GNT/AP/2014/BB/G,12.11.2014,12.11.2019,16.478789,79.893642
51,Red Cross Blood Bank,Andhra Pradesh,GUNTUR,Repalle," Government Hospital Premises
 Repalle-522265
 Guntur Dist,A.P
",522265,08648 223939,9177883353,NA,"NA				",rplredcrossbb@gmail.com,,Dr. V. Veera Raghavaiah,08648 - 223939,9177883353,dr.raghava2015@gmail.com,"MBBS, DCH",Charity,NO,NO,24x7,09/GNL/2006/AP/BB/R,"03.11.2006	",02.11.2016,16.017425,80.829475
52,Area Hospital (Repeated),Andhra Pradesh,GUNTUR,Tenali,"Blood Bank Medical Officer,  Blood Bank, Area Hospital, Tenali, Guntur District",522201,,9866686760,,,tenalibloodbank@gmail.com,,,,,,,NA,,,24x7,,,,16.239531,80.64934
53,APVVP District Hospital Blood Bank,Andhra Pradesh,GUNTUR,Tenali,"APVVP District Hospital Premises, Chenchupeta, Tenali, Guntur",522202,,,,,,,Dr. Sujhatha,8985100299,,tenalibloodbank@gmail.com,,Government,YES,,,,,,#N/A,#N/A
54,Rudhira Voluntary Blood Bank,Andhra Pradesh,GUNTUR,Tenali,"D.No. 7-5-56, KRR Complex, 1st Floor, Opposite ASN college, Prakasam Road, Ganganammapeta, Tenali",522201,"08644 231222, 08644 654123",9247155622,NA,NA,"maruthi_nagalingam@yahoo.com	",,Dr. C. Rajesh,NA,9949934144,rudhira.voluntary@gmail.com,MBBS,Private,NO,NO,24x7,13/GNT/AP/2010/BB/CP,20.08.2010,21.03.2019,16.243428,80.646397
55,Best Rotary Blood Bank,Andhra Pradesh,GUNTUR,Tenali,"Mahila Mandali Building, Sarojini Naidu Street, Kothapeta, Tenali 
",522201,NA,"09849833321	","NA		",NA,NA,,Dr. Siva Vara Prasad,NA,8143911234,bestrotarybloodbank@gmail.com,"MBBS	",Private,NO,NO,24X7,2/GNT/AP/2010/BB/G,"27.02.2010	",26.02.2015,16.251179,80.64934
56,Area Hospital Blood Bank,Andhra Pradesh,KRISHNA,Gudivada,Gudivada,521301,08674 245040,7799990904,NA,NA,areahospital.gudivada@gmail.com,,Dr. Satyanarayana,NA,9848607402,areahospital.gudivada@gmail.com,"MBBS, Diploma in Orthopaedics",Government,NO,NO,24x7,84/KR/AP/97/BB/R,17.04.1997,31.12.2017,16.349045,81.049715
57,Dr. Pattabhi Red Cross Blood Bank ,Andhra Pradesh,KRISHNA,Machilipatnam,"DM & HO Campus, Machilipatnam",521001,08672 230605,NA,NA,NA,drprcbloodbankmtm@gmail.com,,Dr. S. V. Ramana,NA,8019905040,drprcbloodbankmtm@gmail.com,"MBBS, DA, DLO",Charity,NO,NO,24x7,11/K.R/AP/2004/BB/G,10.08.2004,21.09.2015,16.190546,81.136154
58,Government General Hospital (Repeated),Andhra Pradesh,KRISHNA,Vijayawada,"Government General Hospital, Ramavarapadu, Vijayawada - 520007",520007,9866686760,8662452244,,,gghbbvij@gmail.com,,,,,,,NA,,,24x7,,,,16.513339,80.618989
59,Government District Headquarters Hospital machilipatnam blood bank,Andhra Pradesh,KRISHNA,Vijayawada,Machilipatnam,521001, 08672 245040,,,,dhmtmbb@gmail.com,,DR .A.B.S. SRINIVASARAO,,,,MD D ORTHO,Government,NO,,24x7,LIC NO.71/KR/AP/1997/BB/R DT. 31-12-2017.,,,16.176867,81.138647
60,Rotary Red Cross Blood Bank,Andhra Pradesh,KRISHNA,Vijayawada,"H.No: 26-5-5, G.S Raju Street, Gandhinagar, Vijayawada - 520003. Krishna District

",520003,"0866 2570082, 0866 6464002",9848124977,NA,NA,redcrosskrishna@gmail.com,,Dr. S. Madhana Mohan,NA,9441902311,redcrosskrishna@gmail.com,MBBS,Charity,YES,NO,24x7,"2/HD/AP/2002/BB/G		",18.02.2002,17.02.2017,16.506174,80.648015
61,Vijaya Sri Blood Bank,Andhra Pradesh,KRISHNA,Vijayawada,"VijayaSri Palace,D. No. 29-19-27/4, Ground Floor, First Floor and Second Floor, Dornakal Road, Suryaraopet, Vijayawada",520002,0866 2433199,9392120187,,,vijayasribloodbankvja @gmail.com,,Dr.T.Gopala Krishna Murthy,9392120187,9701233199,drtgopalakrishnamurthy @yahoo.com,MBBS,Charity,YES,YES,24x7,14/KR/AP/2005/BB/CP,29-4-2013,28-4-18,16.51304,80.635644
62,Lions Blood Bank,Andhra Pradesh,KRISHNA,Vijayawada,"D. No. 29-19-85, 1st & 2nd Floor,Old Janatha Hospital Building, Dornakal Road, Suryaraopet, Vijayawada
",520002,0866 2434417,NA,NA,NA,lionsbloodbank@yahoo.com,,Dr. Kiran Kumar,NA,NA,NA,MBBS,Charity,NO,NO,24x7,22/KR/AP/2009/BB/G,18.12.2009,17.12.2014,16.506174,80.648015
63,University General Hospital Blood Bank,Andhra Pradesh,KRISHNA,Vijayawada,"Ring Road, Gunadala, Vijayawada",520 008,"0866 2452244, 0866 2453488",NA,NA,NA,"gghbbvij@gmail.com	",,Dr. V. Kiranmayee,NA,9440357428,"kiranmayi.bogarapu@gmail.com, ","MBBS, MD (Bio-chemistry)",Government,NO,NO,"24x7			",66/KR/AP/97/BB/CP,28.01.1997,"31.12.2017	",16.516111,80.670085
64,M/s. Chaitanya Blood Bank,Andhra Pradesh,KRISHNA,Vijayawada,"40-9/1-26, Vasavya Complex, Benz Circle, Vijayawada
",520010,"0866 2497977, 0866 645977",9246289777,NA,NA,NA,,Dr. Rama Reddy,NA,9246289777,chaitanyabloodbank@gmail.com,MBBS (MD Pathology),Charity,YES,YES,24x7,19/KR/AP/2010/BB/G,21.12.2010,20.12.2019,16.498839,80.655488
65,Nagarjuna Hospital Blood Bank,Andhra Pradesh,KRISHNA,Vijayawada,"Kanuru, Vijayawada",,0866 2554701,9848141550,,,,,,,,,,Private,NO,,,,,,16.4948205,80.6891524
66,Saint Ann&#39;s Hospital Blood Bank  ,Andhra Pradesh,KRISHNA,Vijayawada,"Punnammathota, Bandhar Road, Vijayawada - 2
",520 002,0866 2572057,NA,NA,NA,annshospitall@gmail.com,,Dr. Rama,NA,9849668937,NA,MBBS,Private,NO,NO,"24x7	",163/KR/AP/2001/BB/R,"07.08.2001		",31.12.2017,#N/A,#N/A
67,Rotary Red Cross Blood Bank (Repeated),Andhra Pradesh,KRISHNA,Vijayawada,"26-5-5, G.S. Raju Road, Vijayawada ",520 003,2570082,,,,,,,,,,,Charity,NO,,,,,,16.525942,80.634075
68,Dr. Pinnamaneni Siddhartha Insitiute of Medical Sciences & Research Foundation (Dr.P.SIMS & RF) Blood Bank  ,Andhra Pradesh,KRISHNA,Vijayawada,Chinnaoutapalli. ,521286,08676 257311,NA,NA,NA,NA,,Dr. Ranga Rao,NA,"09866500278	",bb.drpsims@gmail.com,"MBBS, MD (Pathology)",Private,YES,NO,"24x7	",07/KR/AP/2003/BB/R,08.04.2003,09.04.2018,16.551655,80.832047
69,Bethesda Blood Bank,Andhra Pradesh,KRISHNA,Vijayawada,"29-10-2, Ground Floor, Narsimharao Street, Suryaraopet, Vijayawada ",,0866 2435888,098498 33321,,,,,,,,,,NA,NO,,,,,,16.512971,80.632664
70,"Smt CH. Manju Vani Vara Prasad, Lions District 316D Blood Bank ",Andhra Pradesh,KRISHNA,Vijayawada,"H.No.29-4-54K, Conan Dhanvoda Anantham Complex, Prakasam Road, Suryaraopet, Vijayawada",520002,0866 2573636,9849118077,NA,NA,lionsbloodbank@yahoo.com,,Dr K S R K Prasad,NA,NA,lionsbloodbank@yahoo.com,MBBS,Charity,YES,YES,24x7,08/KR/AP/2005/R,14.12.2005,13.12.2015,16.510309,80.63251
71,Suraksha Voluntary Blood Bank,Andhra Pradesh,KRISHNA,Vijayawada,"29-10-8, Govinda Rajulu Naidu Street, Suryaraopet, Vijayawada 
",520002,0866 2434499,9394777899,NA,NA,surakshabloodbank@gmail.com,,Dr. C. S. R. Prasad,"0866 2434499	",9394777899,surakshabloodbank@gmail.com,"MBBS, MS",Charity,YES,NO,"24x7	",03/VJ/AP/2009/BB/CP,22.04.2009,02.05.2017,16.51343,80.632861
72,M/s Ayush Nri Lepl Health Care Private Limited  ,Andhra Pradesh,KRISHNA,Vijayawada,"First Floor, D. No. 40-13-3& 3A, Ring Road, Sriramachandra Nagar, Vijayawada
",520008,0866 2541414,8498061158,NA,NA,NA,http://www.aayushhospitals.com,"Dr. P. Padma, Dr. Prahlad Rao	",NA,"08498061186, 09848377347",bloodbank@aayushhospitals.com,"MBBS, MD (Pathology)",Private,YES,YES,24x7,01/VJ/AP/2014/BB/G,22.05.2014,21.05.2019,#N/A,#N/A
73,M/s. Nimra Institute of Medical Sciences ,Andhra Pradesh,KRISHNA,Vijayawada,"Ground Floor, Adjacent to Central Lab, Teaching Hospital & Research Centre, Nimranagar, Jupudi, Ibrahimpatmnam, Vijayawada.Krishna ",521456,"0866 6500000, 0866 6545454",,,,nimrabloodbank@gmail.com,,,,,,,Private,YES,NO,,07/KN/AP/2012/BB/G,,,#N/A,#N/A
74,"RCH -II Blood Bank, Area Hospital, Adoni",Andhra Pradesh,KURNOOL,Adoni,"Dr. H. Siva Reddy, Civil Surgeon RMO (Rtd),Medical Officer  IRCS, RCH-II, Blood Bank, Area Hospital, Adoni-518301",518301,,9440503302,,,drhsivareddy123@gmail.com,,,,,,,Government,NO,NO,24x7,26/KNL/AP/2009/BB/G,12/10/2010,11/10/2015.   SENT FOR RENEWAL ON 10/09/2015 ,15.632223,77.272837
75,M/s. Indian Red Cross Society Blood Bank RCH 2,Andhra Pradesh,KURNOOL,Adoni,"First Floor, Government Area Hospital, Adoni, Kurnool
",518301,NA,9440503302,NA,NA,NA,,"Dr. Shiva Reddy	",NA,9440503302,ircsbloodbank@gmail.com,MBBS,Charity,NO,NO,24x7,26/KNL/AP/2009/BB/G,12.10.2010,11.10.2015,15.632223,77.272837
76,M/s. Government General Hospital Blood Bank,Andhra Pradesh,KURNOOL,Kurnool,kurnool,518002,,9985676311,,,knlgghbloodbank@gmail.comsupdtgghknl@gmail.com,,,,,kulgghbloodbank@gmail.com,,Government,,,24x7,,,,15.820654,78.038088
77,M/s. Indian Red Cross Society Blood Bank,Andhra Pradesh,KURNOOL,Kurnool,"Opposite Ravi Theatre, D.M & H.O Compound, Beside Control Room, Kurnool
",518002,08518 255347,9490601960,NA,NA,indianredcrossknl@yahoo.com,,"Dr. M. Venkatayya, Dr. Mumtaz Aziz",NA,"09440251277, 09490601960",ircsbloodbankknl@gmail.com,"MBBS, MD (Pathology)",Charity,YES,YES,"24x7	","3/KL/AP/2004/BB/R	",03.03.2004,14.03.2019,15.816357,78.040317
78,M/s. Viswa Bharathi General Hospital Blood Bank,Andhra Pradesh,KURNOOL,Kurnool,"2nd Floor, R. T. Nagar, Near Penchikalapadu (v) Kallur (m), Kurnool ",518002,08518 283964,,,,,,,,,vbghbbknl@gmail.com,,Government,,,,,,,15.8132734,78.0380988
