664,Netaji Subhash Chander Bose Zonal Hospital Blood Bank,Himachal Pradesh,MANDI,Mandi,"Netaji Subhash Chander Bose Zonal Hospital, Mandi",175001,01905 222213,9418316416,,01905 225930,aripooja.ar@gmail.com,,Dr Arindom Roy,01905 222213,9418316416,aripooja.ar@gmail.com,MD (Pathology),Government,YES,NO,24X7,"BB/NZ/10-70	","04-03-1997	",8/5/2016,31.711561,76.927209
665,Rohru Civil Hospital Blood Bank ,Himachal Pradesh,SHIMLA,Rohru,"Rohru, Shimla",171207,01781 240011,"09418084314	",,01781 240011,smorohru@gmail.com,,Dr. Sunil Sharma,17812400011,,drsunilsharma@gmail.com,,Government,NO,NO,24X7,"MB/06/366	","27-11-2006	",Under Process,31.201285,77.752272
666,Indira Gandhi Medical College Blood Bank Shimla,Himachal Pradesh,SHIMLA,Shimla,"Department of BT and IH, Indira Gandhi Medical College, 
Near Lakkar Bazar",171001,0177 2883440,9418091908,,0177 2658339,bbigmc@gmail.com,,"Dr. M. L. Kaushal		","09418091908	","09418091908	",bbigmc@gmail.com,MD (Microbiology),Government,YES,NO,24X7,"MB/03/68	",1976 as BCSU-2003,19-02-2018,31.1071605,77.1831203
667,Deen Dayal Updhayay Hospital Blood Bank,Himachal Pradesh,SHIMLA,Shimla,"DDU Complex, Shimla",171001,0177 2658940,9418462397,,,,,Dr. Rajnish Sood,,9418083737,drrajnishsood@gmail.com,MD (Microbiology),Government,NO,NO,9:30 am to 8pm,"MB/92/5	","9/10/84-20/10/82	",31/12/2016,31.103536,77.17218
668,Kamla Nehru Hospital Blood Bank,Himachal Pradesh,SHIMLA,Shimla,"Kamla Nehru Hospital, NH-22, Near Mall Road",171001,0177 2624081,9418173271,,,bbknhsml@gmail.com,,"Dr. Gagandeep Dhilon	","09418173271	","09418173271	","gagansirdhillon@yahoo.com	",MBBS,Government,NO,NO,24X7,"MB/06/446	","2006	",14-12-2016,31.096648,77.175267
669,Mahatma Gandhi Medical Services Blood Bank Rampur,Himachal Pradesh,SHIMLA,Shimla,"Mahatma Gandhi Medical Services Blood Bank Rampur,
Near Jakh Institute of Nursing",172001,01782 233969,9418470772,,01782 234969,padam0108ps@gmail.com,,Dr Padam Dev Sharma,"09418470772	","09418470772	","padam0108ps@gmail.com	",MBBS,Government,NO,NO,24X7,"MNB/04/83	","09-09-2004	",Under Process,31.4470213,77.6294213
670,Nahan Regional Hospital Blood Bank ,Himachal Pradesh,SIRMAUR,Nahan,"Regional Hospital, Nahan ",173001,01702 223344,9418087764,,01702 224890,,,"Dr. Vinay Kumar	","09418087764	","09418087764	","drvinayguptanhn@yahoo.com	",MBBS,Government,NO,NO,24X7,"MB/96/13	","15-01-1996	",31-12-2016,30.559933,77.295483
671,Malhotra Super Speciality Hospital Blood Bank ,Himachal Pradesh,SOLAN,Baddi,"(A Unit of Malhotra Clinics Private Limited), SCO No. 8, Himuda Bhatoli Kalan, Opp.- Mahavir Spinning Mills, Baddi",173205,01795 275009,9816020120,,1795275010,drmukeshmalhotra@gmail.com,,Dr. Jagtar Singh Devgun,01795 275009,9815175652,jagtardevgun@yahoo.com,MBBS,Private,YES,NO,24*7,,,12/3/2018,30.9491629,76.8319738
672,Maharishi Markendeshwar Medical College and Hospital Blood Bank,Himachal Pradesh,SOLAN,Lado,"LADO, Sultanpur Road, Kumarhatti, Solan
",173229,01792 395175,,,,msoffice@mmusolan.org,,Dr. M.L Gupta,01792 395175,8350800224,ml_g_54@yahoo.co.in,,Charity,YES,NO,24X7,"S-BB/2012-01	","10-12-2012	",9/12/2017,30.8713445,77.0863049
673, Solan Regional Hospital Blood Bank,Himachal Pradesh,SOLAN,Solan,"Regional Hospital, Near Lakkar Bazar, Tank Road",173212,01792 220159,9418483517,,1792224181,safebloodrhs@gmail.com,,Dr. Bhagwan Dass Negi,1792220159,9418483517,negidrbd@gmail.com,MBBS,Government,NO,NO,24X7,"MB/96/14	","30-12-1996	",Under Process,30.90738,77.107075
674,Una Regional Hospital Blood Bank ,Himachal Pradesh,UNA,Una,"Regional Hospital, Una",174303,01975 226064,9805411234,,01975 226064,bloodbankuna2@gmail.com,,"Dr. Anita Sharma 		",9418028018,9418028018,bloodbankuna2@gmail.com,MD (Pathology),Government,NO,NO,24X7,MB/97/01,"01-01-1999	",under process,31.4785791,76.2741605
675,MMAB memorial District Hospital  Blood Bank Anantnag,Jammu and Kashmir,ANANTNAG,Anantnag,"MMAB memorial Blood Bank, Janglat Mandi, District Hospital, Anantnag",192101,01923 222170,01923 222170,,01923 222170,,,Dr. Farhat mustafa,,9419083038,fm2683@gmail.com,,Government,NO,NO,24X7,Jk-02/05-06/87,27-06-2005,27-06-2010,33.7253569,75.153155
676,Baramulla District Hospital Blood Bank,Jammu and Kashmir,BARAMULLA,Baramulla,"District Hospital, Kanthbagh, Baramulla",193101,01952 234203,9797218141,,1952234203,bbankdhbla@gmail.com,,Dr Riyaz Ahmed War,9797218141,9797218141,drriyazwar@gmail.com,MBBS,Government,NO,NO,24*7,Reapplied for license (Due to shift in new complex ),,Under Process ,34.2031312,74.3654033
677,Chodana Sub-District Hospital Blood Bank,Jammu and Kashmir,Budgam, Budgam ,"Sub-District Hospital, Chadoora, Budgam",191113,01951 257236,9596301711,01951 257236,01951 256236,,,Bashir Ahmed Rather,,9419035800,"bmochadoora@gmail.com	",,Government,NO,NO,24*7,"JK/02/11-12/175	","04-05-2011	",03-05-2016  (Under Process),33.9429341,74.7993502
678,Budgam District Hospital Blood Bank ,Jammu and Kashmir,Budgam,Budgam ,"ASYM District Hospital Campus, Near District Court Complex",191111,1951255238,9419035800,01951 255237,,medsupdhb@gmail.com,,Dr. Furqan Iqbal bhat,9419035800,9419035800,drfurqanbhat@gmail.com,MBBS ,Government,NO,NO,24*7,"JK/02/06-07/117	","November - 2006	",16-Nov,34.020827,74.719824
679,Doda District Hospital Blood Bank ,Jammu and Kashmir,DODA,Doda,"District Hospital, Doda",182202,01996 233689,9419168144,01996 233689,,,,Dr. Anayat lone,9419168144,9419168144,drloneanayat@gmail.com,MD (Pathology),Government,NO,NO,24X7,Jk/01/45,31-12-2006,31-12-2011,33.144377,75.543698
680,District Hospital Blood Bank Ganderbal ,Jammu and Kashmir,GANDERBAL,Ganderbal,Ganderbal,191201,0194 2416158,,,,,,,,,,,Government,,,,,,,34.1944531,74.652155
681,Government Hospital Blood Bank Gandhi Nagar,Jammu and Kashmir,JAMMU, Jammu ,"Government Hospital, Gandhi Nagar, Jammu",180001,0191 2430041 ,9419187114,0191 2430041 ,0191 2430041 ,,,Mr. U. K. Padha,9419187114,9419187114,utterpadha77@gmail.com,Lab Technician ,Government,NO,YES,24X7,Jk/01/63,28-09-2014,Under process,32.705277,74.859974
682,Government Medical College and Hospital Blood Bank,Jammu and Kashmir,JAMMU,Jammu ,"Government Medical College and Hospital, Mahesh Pura Chowk, Bakshi Nagar",180001,"0191 2584290, 0191 2584291, 0191 2584292",9419184710,,0191 2584234,sawhney.461@rediffmail.com,http://www.gmcjammu.nic.in,Dr. Vijay Sawhney,9419184710,9419184710,sawhney.461@rediffmail.com,"MBBS, DCP, MD",Government,NO,YES,24X7,JK-01/22,26-12-1996,01-01-2012 to 31-12-2016,32.736061,74.853998
683,Sri Maharaja Gulab Singh (SMGS) Hospital Blood Bank,Jammu and Kashmir,JAMMU,Jammu ,"Shalamar Road, Indra Chowk, Jammu",180001,"0191 2547635, 0191 2547639",,0191 2547635,0191 2584247,,http://gmcjammu.nic.in/smgs.aspx,"Dr. Meena Sidhu  	","09419201716	","09419201716	",minapthapa@gmail.com,"MBBS, MD (Pathology)",Government,YES,NO,24X7,JK/01/22,"26-12-1996	",31-12-2016,32.733578,74.862023
684,Bee Enn General Hospital Blood Bank,Jammu and Kashmir,JAMMU,Jammu ,"Garden Avenue, Bhagwati Nagar, Talab Tillo, Jammu",180002,1912555631,,,1912552086,bngh@beengroup.com,http://www.beeenngroup.com/,Dr. K.K Khanna,,9419139241,nekramsharma@gmail.com,,Charity,,,24X7,,,,32.7297174,74.8411347
685,Sainik Asptal Blood Bank Satwari,Jammu and Kashmir,JAMMU,Satwari,"166, Military Hospital, C/o. 56 APO",180003,0191 2456006,,,0191 2457168,,,"Dr. Sharad Bhalla	",8800171973,8800171973,," MBBS, MD (Microbiology) ",Government,NO,NO,N/A,"JK-01-23		",26-12-1996,16-Dec,32.6951007,74.8413348
686,Acharya Shri Chander College of Medical Sciences and Hospital Blood Bank,Jammu and Kashmir,JAMMU,Sidhara,"Acharya Shri Chander College of Medical Sciences and Hospital, N.H ByPass P.O Majeen",180017,0191 2662324,,,,,,Dr. Mrs. Kumkum Sharma,,9419193919,tandonkumdr@yahoo.com,,Charity,YES,,,,,,32.760493,74.898955
687,Kargil District Hospital (Kargil Ladakh Kashmir Division) Blood Bank ,Jammu and Kashmir,KARGIL,Kargil ,"District Hospital, Kargil Ladakh Kashmir Division, Jammu and Kashmir",194103,001985-232213,9419888523,,,,,Dr. Mohamad Ali,9419895566,9419895566,draliadulpa@gmail.com,"MBBS, Diploma in Pathology ",Government,NO,NO,24*7,"JK/02/05-06/103 	 ","21-03-2006	",Under Process,34.559251,76.124874
688,Kathua District Hospital Blood Bank ,Jammu and Kashmir,KATHUA,Kathua ,"District Hospital, Kathua ",184102,01922 234323,9419176206,,01922 234323,,,Dr. Uttra Samnyal,,9419176206,Rajubhau1969@gmail.com,"MBBS, PG (Transfusion Medicine)",Government,NO,NO,N/A,BB-JK/01/46,23-03-1999,Under Process,32.390815,75.5252
689,Kishtwar District Hospital Blood Bank  ,Jammu and Kashmir,KISHTWAR,Kishtwar ,"District Hospital, Near Bus stand Kishtwar.",182204,01995 261410,9018497123,,1995261410,bloodbankkishtwar@gmail.com,,Dr. Khanchan,,8492907929,dr.khanchain0115@gmail.com,"MBBS, DCP",Government,NO,NO,24X7,JK/01/05-06/79,18-05-2005,17-05-2010 (Under Process) ,33.3139274,75.7681239
690,Kulgam District Hospital Blood Bank ,Jammu and Kashmir,KULGAM,Kulgam ,"Kulgam Quzigund Road, opposite to Fruit mandi Kulgam",192231,01931 260398,9622749024,01931 260398,,,,Dr. Ashaq Hussian,9419003595,9419003595,agaashaq786@yahoo.com,MBBS,Government,NO,NO,24*7,JK/02/11-12/184,6/2/2012,5/3/2017,33.645305,75.026719
691,Handwara District Hospital Blood Bank,Jammu and Kashmir,KUPWARA,Handwara,"Handwara Hwy, Shaheen Colony, Durashpora, Handwara",193221,01955 262054  ,9622221424,,01955 262054  ,d.r.randwara@gmail.com,,Dr. Aijaz Ahmad Bhat,,9419009657,dr.aijazbht@gmail.com,,Government,NO,NO,24*7,Applied For License ,,,34.396437,74.284765
692,General Hospital Blood Bank,Jammu and Kashmir,LEH LADAKH,Leh,"153, General Hospital, C/o. 56 APO, Leh Ladakh ",194101,01982 254746,"09906982587, 094191235102",,,,,,,,,,Government,,,N/A,,,,#N/A,#N/A
693,SNM Hospital Blood Bank,Jammu and Kashmir,LEH LADAKH,Leh ,"SNM Hospital, Main Bazar, Leh",194101,01982 252014,9622181045,,,,,Dr. Sonam Angmo,9419219750,9419219750,sonamangmo61@yahoo.in,MD (Pathology),Government,NO,NO,24X7,JK.02/05.06.101,14-01-2011,Under Process,34.153795,77.580209
694,Raja Sukhdev Singh District Hospital Poonch,Jammu and Kashmir,POONCH,Haveli,"District Hospital, Poonch",185101,"01965 220152, 01965 220656","941,960,182,309,419,000,000",,01965 220152,zabas63@gmail.com,,Dr. Eshart Hussian,1965220152,9419601823,dr.eshrathussain@gmail.com,,Government,NO,NO,24X7,JK/01/09-10/163,18-08-2009,17-08-2014,33.772293,74.098062
695,Pulwama District Hospital Blood Bank ,Jammu and Kashmir,PULWAMA,Pulwama,"District Hospital, Pulwama",192301,01933 241530,"09419757644, 09419070964",,01933 241530,bbdhpulwama@gmail.com,,Dr. Mir Khursheed,,9697004411,drmirkhursheed@gmail.com,"MBBS, Fellowship in Transfusion Medicine ",Government,NO,NO,24*7,JK/02/05-06/88,"27-06-05 renewd in 2012upto 2015 	",Inspected In Nov 2015 -Under Process,33.878861,74.900779
696,General Hospital Blood Bank (Army),Jammu and Kashmir,RAJOURI, Rajouri ,"150, General Hospital, Rajouri",185131,01962 263921 ,9596711669,,,,,"Major  Dr. Abhishek Rai 	","09596711669	","09596711669	",abhishekrai12@gmail.com,"MBBS, MD (Pathology) ",Government,NO,NO,24X7,"JK/01/33	",2/12/1998,31-12-2016,#N/A,#N/A
697,Rajouri District Hospital Blood Bank ,Jammu and Kashmir,RAJOURI,Rajouri,"District Hospital,  kheora, Rajouri
",185131,01962 263209,9419267266,01962 263209,01962 263209,,,Dr. Zulfikar Ahemd,,9858263357,chzulfikar@gmail.com,,Government,NO,YES,24X7,"JK/01/66	","28-02-2005	",27-02-2010 (Renewal under process ),33.3880811,74.316008
698,Ramban District Hospital Blood Bank ,Jammu and Kashmir,RAMBAN,Ramban,"NH1A, Upper Bazaar, Ramban,",182144,01988 266908,9419211432,,01988 266908,,,Dr. Parvez Ahmed Katoch,9419211432,9419211432,basharat.97@gmail.com,,Government,NO,NO,24X7,Applied For License,,,33.2420569,75.2392611
699,District Hospital Blood Bank Sambha ,Jammu and Kashmir,SAMBA,Samba,"District Hospital, Near Sabzi Mandi, Samba",184121,9419118345,,,,,,,,,,,Government,,,,NON FUNCTIONAL,,,32.560515,75.120911
700,District Hospital Blood Bank Shopian ,Jammu and Kashmir,SHOPIAN,Shopian,Shopian,192303,01933 261845,9906691206,,,,,,,,,,Government,,,24X7,,,,33.7200624,74.8338034
701,Shri Maharaja Hari Singh (SMHS) Hospital Blood Bank,Jammu and Kashmir,SRINAGAR, Srinagar ,"SMHS Road, Near Gold Market, Karan Nagar, Srinagar, ",190010,"0194 2504801, 0194 2504802 (Extn. 512) ",9419466823,,0914 2504798,bloodbanksmhshospitalsgr@gmail.com,,Dr. Shazia Handoo,0194 2504801,9419405442,handooshaziadr@gmail.com,MD (Pathology),Government,YES,YES,24X7,Applied for new license due to shift in new complex,,,34.0862001,74.7977402
702,92 Base Hospital Blood Bank,Jammu and Kashmir,SRINAGAR, Srinagar            ,"92 Base Hospital, C/o. 56 APO,  Badami Bagh, Srinagar",190004,0194 24660009 (Extn. 6528),9419025840,,,yes,,Dr. N. PathaK,9419025840,9419025840,92basehospital@gmail.com,"MBBS, MD (Pathology)",Government,NO,NO,24X7,"JK/01/53	","21-09-2012	",20-09-2017,34.06591,74.856181
703,Sher-I-Kashmir Institute of Medical Sciences (SKIMS) Blood bank,Jammu and Kashmir,SRINAGAR,Srinagar ,"Sher-I-Kashmir Institute of Medical Sciences (SKIMS), 
Anchar, Soura, Srinagar",190011,0194 2401013,9419081023,,,bloodtransfusion@skims.in,http://www.skims.ac.in/,Dr. Fahmida Akhter,0194 2401013,,dr.fameedaakhtar@gmail.com,,Government,YES,YES,24X7,,1/1/2012,31-12-2016,34.136677,74.800264
704, Government Lal Ded Hospital Blood Bank,Jammu and Kashmir,SRINAGAR,Srinagar            ,"Wazirbagh, Srinagar GPO, Srinagar",190001,"0194 2313714, 0194 2313716",9797937999,0194 2313714,"0194 2313720, 0194 2313721",,http://www.gmcs.edu.in,"Dr. Javaid Iqbal khan 	 ","09797937999	",9419957270,drjavaidiqbalkhanpathan@gmail.com,"MD (Medicine), Trained Haematologist & Transfusion Specialist AIIMS  Delhi",Government,YES,NO,24X7,"JK/O2/05-06/89	 ","27-07-2005	",26-06-2015 (UNDER PROESS),34.0667492,74.8081809
705,Government Bone and Joint Surgery Hospital Blood Bank,Jammu and Kashmir,SRINAGAR,Srinagar ,"Government Bone and Joint Surgery Hospital, Near Barzulla bridge, Srinagar",190005,1942432135,9419720762,,0194 2430149,,,Dr.Mehmooda saif,9419720762,9419720762,dr.mehmooda297@gmail.com,MBBS,Government,NO,NO,24X7,JK/02/11-12/186,30-12-2011,2016,34.0481,74.80522
706,Jawahar Lal Nehru Memorial Hospital Blood Bank,Jammu and Kashmir,SRINAGAR,Srinagar ,"Jawahar Lal Nehru Memorial Hospital Blood Bank, Rainwari, Srinagar",190003,0194 2507099,,0194 2507099,0194 2507099,,,Dr. Afaq Ahmad Khan,"09419003346	","09419003346	",drafaqak@yahoo.co.in,MD (Haematology & Transfusion Medicine),Government,NO,NO,24X7,"JK/02/BB/2012-13/198	",,2017,34.097759,74.821651
707,Command Hospital Blood Bank ,Jammu and Kashmir,UDHAMPUR,Udampur ,"Command Hospital, Uttari Kaman, C/o Uttari Kaman, Udhampur",182101,,,,,,,,,,,,Government,,,24X7,,,,32.930786,75.135348
708,Udhampur District Hospital Blood Bank ,Jammu and Kashmir,UDHAMPUR,Udhampur,"Udhampur  District Hospital, Near ITI collage",182101,01992-270402,9419222969,,1992270402,msudh1@rediffmail.com,,Dr. Shaveta Sharma,"09419222969	","09419222969		",drshavetasharma@gmail.com,MBBS,Government,NO,NO,24X7,"JK/01/47	","01-01-2008	",31-12-2017,32.919922,75.132831
709,Indian Red Cross Society Blood Bank Bokaro,Jharkhand,BOKARO,Bokaro,"IRCS, Blood bank, Pandit Jawahar lal Nehru Marg, Near Airport, Sector 1 B.S. City",827001,"06542 224555, 06542 288137",9431321798,06542-224555,,bbircsbokaro@gmail.com,,Dr. U Mohanty,9431321798,9431321798,drumohanty@yahoo.com,MD,Charity,NO,NO,9:00 AM to 6:00PM,JH/BB/23/2009,9/2/2009,Applied for renewal ,23.644138,86.151112
710,Bokaro General Hospital Blood Bank,Jharkhand,BOKARO,Bokaro,"Blood Bank, Bokaro General Hospital, Sector - 4, Bokaro Steel City",827004,6542289076,8986872991,,,bloodbankbgh@gmail.com,,Dr Shrawan Kumar,8986872991,8986872991,drshrawan.kumar88@gmail.com,MD,Government,YES,NO,,JH/BB/1146/1995,14-02-1995,31-12-2012 (Applied),23.675112,86.145632
711,K.M. Memorial Hospital & Research Center Blood Bank,Jharkhand,BOKARO,Bokaro,"Blood Bank, K.M. Memorial Hospital & Research Center, By Pass Road Chas Bokaro",827013,0651 236188189,9234303421,,,kmmbloodbank@gmail.com,,Dr. Vikas Panday,0651 236188189,9431127270,dr.vikaspandey@rediffmail.com,MD,Private,NO,NO,24X7,JH/BB/09/2004,17-02-2004,16-02-2019,23.633257,86.173506
712,Deoghar Sadar Hospital Campus Blood Bank ,Jharkhand,DEOGHAR,Deogarh,"Blood Bank, Sadar Hospital, Deoghar ",814112,9431950386,9234870137,,,bloodbanddeoghar@gmail.com,,Dr Manoj Kumar Gupta,,9234870137,guptamanojdr@rediffmail.com,MBBS,Government,NO,NO,24X7,JH/BB/10/2004,7/5/2004,04-07-2014 (Applied 05.07.2014 to  04.07.2019),24.491027,86.693996
713,Patliputra Medical college and Hospital (PMCH) Blood Bank Dhanbad,Jharkhand,DHANBAD,Dhanbad,"PMCH, Saraidhela, Dhanbad, PO. BCCL Township",826005,0326 2230301,9431188793,,,bloodbankpmch@gmail.com,,DR.B.C.Banerjee,0326 2230301,9431188793,bloodbankpmch@gmail.com,MD,Government,NO,NO,24X7,JH/BB/33/2012,24-07-2012,23-07-2017,23.7976877,86.4356088
714,Central Hospital Blood Bank BCCL Dhanbad,Jharkhand,DHANBAD,Dhanbad,"Blood Bank, Central Hospital, BCCL, Dhanbad",826003,9470595563,9470595653,,,,,D. K. Jha ,9470595563,9470595563,drdkjh09@gmail.com,MD,Private,NO,NO,24X7,JH/BB/916/1990,31-12-1990,30-12-2001,23.8057146,86.4509654
715,S. N. Chakraborty Memorial Chakraborty Nursing Home Blood Bank,Jharkhand,DHANBAD,Dhanbad,"Debraj Complex, Dhansar, Dhanbad",828106,0326 2303621,9939900855,,,ranjansnh6@gmail.com,,Dr. C.S. Suman,0326 2303621,7765044779,drcsuman@gmail.com,"MBBS, DCP",Private,NO,NO,24X7,JH/BB/25/2010,29-01-2010,28-01-2015,23.781238,86.413028
716,Dwarka Das Jalan Memorial Hospital Bartand Blood Bank ,Jharkhand,DHANBAD,Dhanbad,"Blood Bank Dwarka Das Jalan Memorial Hospital Bartand, Dhanbad",826001,3262313525,9204061081,,,jalanbloodbank@gmail.com,,Dr. Krishna Mohan Sahai,,9334293592,kmsdhn@gmail.com,"MBBS, DOP",Private,NO,NO,24X7,JH/BB/29/2011,20-12-2011,19-12-2016,23.806393,86.43059
717,Dumka Sadar Hospital Blood Bank ,Jharkhand,DUMKA,Dumka,"Near Town Hall, Dumka",814101,6434236298,9341190075,,,bloodbankdumka@gmail.com,,Dr. Debashish Rakchit,9341190075,9341190075,bloodbankdumka@gmail.com,MBBS,Government,NO,NO,24X7,JH/BB/13/2006,13-05-2013,5/12/2018,24.267264,87.251613
718,MGM Medical College Hospital Campus Blood Bank Jamshedpur,Jharkhand,EAST SINGHBHUM,Jamshedpur,"Sakchi, Jamshedpur",831001,0657 2230092 ,9431459163,,,bloodbankmgm@rediffmail.com,,Dr. V. B. K. Choudhary,9431459163,9431459163,bloodbankmgm@rediffmail.com,MD (Pathology),Government,NO,NO,24X7,JH/BB/26/2010,5/10/2010,5/9/2015,22.811699,86.210334
719,Jamshedpur Blood Bank ,Jharkhand,EAST SINGHBHUM,Jamshedpur,"Stocking Road, Northern Town. Bistupur",831001,0657 2431957,9431346147,,,jbbjsr@gmail.com,,Dr Lav Bahadur Singh,9431346147,9431346147,jbbjsr@gmail.com,MBBS,Charity,YES,NO,24X7,JH/BB/766/1987, 01.12.1987,31-12-2017,22.804227,86.181256
720,Garhwa Sadar Hospital Campus Blood Bank ,Jharkhand,GARHWA,Garhwa,"Blood Bank, Sadar Hospital Garhwa",822114,06561 222005,9955469085,,,bloodbankgarhwa@yahoo.in,,Dr. Ram Vinod Kumar,9955469085,9955469085,ramvinodkumar4@gmail.com,MD (Pathologist),Government,NO,NO,24X7,JH/BB/21/2008,13-07-2008,12/7/2013,24.158163,83.802052
721,Giridih Sadar Hospital Blood Bank ,Jharkhand,GIRIDIH,Giridh,"Blood Bank, Sadar Hospital Giridih",815301,06532 250357,9331743396,,,bloodbankgrd@gmail.com,,Dr. Sunil kumar Singh,06532 250357,9331743396,dr.sunilkumarsinghrd@gmail.com,MBBS,Government,NO,NO,24X7,JH/BB/1227/96,16-12-1996,31-12-1997 (Applied 2012-2016),24.1879903,86.3064543
722,Gumla Sadar Hospital Blood Bank ,Jharkhand,GUMLA,Gumla,"Blood Bank, Sadar Hospital Gumla, Jharkhand",835207,9534032306,9534032306,,,bloodbankgumla@gmail.com,,Dr. Anand Kishore Oraon,9534032306,9534032306,oraonanand02@gmail.com,MD (Pathologist),Government,NO,NO,24X7,JH/BB/19/2007,12/10/2007,09-12-2012 (Pending),23.0346771,84.5383358
723,Hazaribag Sadar Hospital Blood Bank ,Jharkhand,HAZARIBAGH,Hazaribagh,"Blood Bank, Sadar Hospital Campus Hazaribag",825301,06546 265289,"08092769023, 08969231140",,,r.khairihzb@gmail.com,,Dr. K.P Singhi,06546 265289,7870306372,r.khairihzb@gmail.com,MBBS,Government,NO,NO,24X7,JH/BB/06/2003,16-10-2003,15-10-2008 (Pending),23.997502,85.3564179
724,TISCO West Bokaro Hospital Blood Bank ,Jharkhand,HAZARIBAGH,Hazaribagh,"Blood Bank, TISCO West Bokaro Hospital, Ghatotand, Hazaribagh",825314,06545 262356,9204069482,,,sindhubaksi@gmail.com,,Dr. S. S. Bakshi,06545 262356,9204069482,sindhubaksi@gmail.com,MD (Pathology),Private,NO,NO,24X7,JH/BB/04/2003      ,23-08-2003 ,23-08-2003 (Applied) ,#N/A,#N/A
725,Koderma Sadar Hospital Blood Bank ,Jharkhand,KODERMA,Koderma,"Blood Bank, Sadar Hospital Koderma",825410,9334516895,9334516895,,,zafar.kod@gmail.com,,Dr. H. K. Sharma,9334516895,9334516895,zafar.kod@gmail.com,MBBS,Government,NO,NO,24X7,JH/BB/32/2012,14-07-2012,13-07-2017,24.188289,86.306465
726,Latehar Sadhar Hospital Blood Bank,Jharkhand,LATEHAR,Latehar,"Sub-Divisional Hospital Blood Bank, Latehar",829206,9835589186,9835589186,,,bloodbanklatehar@gmail.com,,Dr Jamiluddin Ahmad,9835589186,9835589186,drjamil9764@gmail.com,MBBS,Government,NO,,24*7,JH/BB/14/2016,28/3/2006,29/8/2011,23.7432844,84.5059776
727,Lohardaga Sadar Hospital Blood Bank ,Jharkhand,LOHARDAGA,Lohardaga,"Blood Bank, Sadar Hospital Lohardagga",835302,6526222235,9334484971,,,curewell@gmail.com,,Dr. A. K. Arya,9334484971,9334484971,curewell@gmail.com,MD,Government,NO,NO,24X7,JH/BB/16/2007,2/12/2007,11/2/2012,23.441722,84.685316
728,Pakur Sadar Hospital Blood Bank ,Jharkhand,PAKUR,,,,9934347811,9934347811,,,cs.pakur@gmail.com,,,,,cs.pakur@gmail.com,,Government,NO,,24*7,JH/BB/35/2013,13/5/2013,12/5/2018,24.6476852,87.7862334
729,Palamu Sadar Hospital Blood Bank ,Jharkhand,PALAMU,Daltonganj,"Daltonganj, palamau",822101,06562 222677,9431787476,,,bloodbankpalamau@gmail.com,,Dr. jayant Lakra,06562 222677,9431138779,bloodbankpalamau@gmail.com,MD (Pathologist),Government,NO,NO,24X7,JH/BB/06/2006,10/1/2005,18-03-2015,24.047051,84.060447
730,CCL Hospital Blood Bank Ramgarh,Jharkhand,RAMGARH,Ramgarh,"Blood Bank, CCL Hospital, Nai Sarai Ramgarh Cantt, Argada Road",829122,06553 231755,9431792122,,,krarvind_dr@yahoo.co.in,,Dr. Arvind Thakur,9431792122,9431792122,kravind_dr@yahoo.co.in,MD (Pathology),Government,NO,NO,24X7,JH/BB/1174/1995,31-12-2012,30-12-2017,23.6484192,85.5093472
731,Military Hospital Blood Bank Ramgarh,Jharkhand,RAMGARH,Ramgarh,"Blood Bank, Military Hospital, Ramgarh Cantt, Ramgarh",829122,06553 225055,06553 225055,,,,,Dr. Kanwaljeet Singh,06553 225055,06553 225055,,MD (Pathologist),Private,NO,NO,24X7,JH/BB/1413/2000,28-01-2000,2016 (Renewed 2012-2016),23.6479087,85.5108896
732,Apurva Blood Bank Ramgarh,Jharkhand,RAMGARH,Ramgarh,Apoorva Blood Bank Ramgarh,829122,9304842607,9304842607,,,,,Dr. Suresh Prasad,9304842607,9304842607,,MD (Pathologist),Private,NO,NO,24X7,JH/BB/31/2012   ,14-06-2012,Last Ins.-26.06.2015 ,#N/A,#N/A
733,"Heavy Engineering Corporation, Plant Hospital Blood Bank",Jharkhand,RANCHI,Ranchi,"Sector III, HEC Campus, Opposite JSCA Stadium, Ranchi",834004,0651 2444336,9835539866,,,cmo@heclltd.com,,Dr. (Mrs.) Anulekha Mukherjee ,0651 2444336,9835539866,"dramukherjee@hecltd.com, cmo@heclltd.com","MD, DCP",Government,NO,NO,24X7,JH/BB/1289/1997,12/8/1997,31-12-2017,23.313367,85.277743
734,"Rajendra Institute of Medical Science (RIMS) Blood Bank, Bariyatu",Jharkhand,RANCHI,Ranchi,"Bariatu, Ranchi, Jharkhand",834009,6512540656,9470516651,,,bldbnkrims@gmail.com,http://www.rimsranchi.org/,Dr. R.K Shrivastava,9470516651,9470516651,dr_ramesh9rims@yahoo.co.in,MD (Pathologist),Government,YES,YES,24X7,JH/BB/14/2006,28-03-2006,27-03-2016  (Apheresis Granted),23.388964,85.349138
735,CCL Hospital Blood Bank Ranchi,Jharkhand,RANCHI,Ranchi,"Central Hospital,CCL, Gandhi Nagar, Kanka Rd, Ranchi ",834008,"0651 2230355,ext 7059",9934386375,,,kdas401@gmail.com,,Dr Krishna Kant Das,,8987785602,kdas401@gmail.com,MD (Pathologist),Government,NO,NO,24X7,JH/BB/1461/2000,5/12/1986,12/3/2014,23.408788,85.321355
736,Indian Red Cross Society (IRCS) Blood Bank Morabadi,Jharkhand,RANCHI,Ranchi,"Morabadi, Near Hockey Stadium, Ranchi",834008,07091494670-75,9431352561,,,redcrosssocietyranchi@gmail.com,,Dr A.K. Agrawal,,7091494670,redcrosssocietyranchi@gmail.com,MBBS,Charity,,NO,24X7,JH/BB/1256/97,9/10/1997,30-01-2013,23.3882502,85.3281205
737,Abdur Razzaque Memorial Weavers Hospital (ARAM) Blood Bank ,Jharkhand,RANCHI,Ranchi,"Blood Bank, ARAM Apollo Hospital, IRBA, Ranchi",835217,0651 7123123,9234303420,,,jh.bb.medantarnc@gmail.com,,Dr. Manju Agarwal,,9934347673,manjugrwl@yahoo.co.in,MD (Pathologist),Private,YES,NO,24X7,JH/BB/27/2010,14-05-2010,13-05-2015,23.4507571,85.4370738
738,Nagarmal Modi Seva Sadan Hospital Blood Bank,Jharkhand,RANCHI,Ranchi,"Blood Bank, Nagarmal Modi Seva Sadan Hospital, Upper Bazar, Ranchi",834001,9234460464,"09234684880, 09204759876",,,,,Dr. S.K. singh,9234460464,9234460464,,MD,Private,,NO,24X7,JH/BB/02/2002,20-11-2002,Renewed Till 2018,23.371161,85.317141
739,Rinchi Trust Hospital Blood Bank,Jharkhand,RANCHI,Ranchi,"Rinchi Trust Hospital Blood Bank, Kathal More, Itki Road, Ranchi.",835303,0651 6456780,9534084500,,,nirajkkmr@gmail.com,,Dr. Soni Praveen Tripathi,0651 6456780,9866924249,sonipraveentrpth22@gmail.com,"MBBS, DCP",Charity,YES,NO,24X7,JH/BB/24/2009,17-08-2009,16-08-2014,23.3451234,85.1106008
740,Devkamal Hospital and Research Centre Blood Bank,Jharkhand,RANCHI,Ranchi,"Bajra Bazar, Bajra, Near IIT Bus Stand, Itki Road",834005,7549000645,9204055638,,,devkamalhospicare@gmail.com,,Dr. Anirban Roy,7549000645,7549000645,devkamalhospicare@gmail.com,MBBS,Private,NO,NO,24X7,JH/BB/30/2011,20-12-2011,19-_ -2016,23.3691335,85.2204851
741,Gurunanak Hospital and Research Centre Blood Bank ,Jharkhand,RANCHI,Ranchi,"Gurunanak Hospital and Research Centre Blood Bank Unit, Station Road, Ranchi.",834001,0651 2460506,9031091565,,,gnhrebloodbank@gmail.com,,Dr. Ramayan Singh,,9031091565,gnhrcbloodbank@gmail.com,MD,Private,NO,NO,24X7,JH/BB/18/2007,4/10/2007,4/9/2017,23.349938,85.330008
